,Tweet
3265,monggo bro jadwal acara upacara adat kirab budaya mbah bergas
3266,sok kenal kunyuk
3267,2 gus ipul mbak puti cipta program program keluarga harap super lengkap program keluarga harap program keluarga harap kembang presiden jokowi gus ipul puti menang
3268,suruh cerita geblek
3269,menang anies sandi bau busuk anyir nanah luka batin luka hina sara benci
3270,cacat
3271,ulama barang sedia malas rejab aban malas ramadan malas
3272,bikin berita media sosial media mainstream kuasa asing perang opini handphone gembos berita media mainstream cina
3273,pro asing jok locator
3274,sipit cantik
3275,ber tato entot thailand enjoy gays kontol coli bahan coli locator
3276,coba usir cina 100 rakyat negara republik indonesia gembel negara republik indonesia asing asing triliun sepe i uras negara republik indonesia stop tolol
3277,salah 1 anggota hati sakit hati organisasi masyarakat bubar maju
3278,dungu budak islam tifatul adam dongeng yahudi
3279,cebong fitnah makan kenyang curang menang
3280,perempuan gembrot langsing badan ku tuju kalimat ku eja cantik l a i e t selamat pagi lupa salat subuh
3281,hebat penjara penjara zaman locator
3282,asing
3283,masya suku kampung selamat deklarasi anti hoaks pilih kepala daerah 2018 damai
3284,hati pa ai indonesia praktik masjid masjid pesantren pesantren huuuft kabuuurr 2019 ganti presiden 2019 ganti presiden
3285,jujur abang like anjing kucing 24 7 gaduh orang gaduh tumbuk then lari rumah selang
3286,atok silap atok hehe macai atok ler macai ph bodoh bangang rakyat x tau x opsss atok
3287,admin tolol pa ai tolol pa ai tolol orang tolol
3288,keluarga pa ai komunis indonesia negara pancasila bineka tunggal ika keluarga
3289,sambut ketua dewan wakil daerah golkar lumajang sudjatmiko putus pa ai khofifah indar parawansa calon gubernur emil elestianto dardak calon wakil gubernur jawa timur pa ai golkar bulat khofifah
3290,dasar kampang
3291,manusia makhluk butuh identitas eksistensi sayang identitas orisinalitas sadar seringkali lekat babi buta remeh identitas dangkal
3292,i at taman budaya sentul city
3293,kejam
3294,haha sekolah katolik agam anak kebun usaha later suku agama terima sekolah katolik alami ubah
3295,subhanallah bahagia pimpin sepe i beliau
3296,syukur allah subhanahu wa taala presiden giat kerja hadap kerja lurus ikhlas mata indonesia maju ramping energi p
3297,mudah lihat orang condong arah sosial media pe ama akun perempuan gambar curi google gambar anonymous manusia kampret akun embel embel nama pahlawan kaum muslim cyber army
3298,calon wakil presiden jokowi 7 orang tinggal presiden terbit dekrit pa ai usung jatah 1 calon wakil presiden jokowi atur perintah ganti undang undang terbit urgensi
3299,malas duduk xleh orang kg budaya kg duduk xleh budaya hebat seram
3300,entot dicrotin kontol uh locator
3301,sepe i kualat bobby mata sipit
3302,franky presiden
3303,sekolah mulut jaga kotor sampah
3304,anjing jahanam berisik cocot
3305,tekan jabat siasat lari lingkar politik antek milik modal islam progresif sesuai mukadimah undang undang dasar amal qs al hujurat
3306,tomohon rupa pusat ajar agama kristen katolik khusus doa meditasi bukit kasih buah suci indah tenang tomohon international flower festival
3307,anies congor gede realisasi janji korupsi dosen bangsat
3308,kesal kacrut televisi republik indonesia
3309,suasana hati kerja ubah banci
3310,kemarin kamis jumat singkat ya
3311,pimpin cerocos nderomos jancuk deh
3312,islam ideologi negara emban wajib sebar dakwah jihad sepe i as sebar demokrasi ussr sebar komunis karang jalan damai kadang perang syariat hukum syriyah kharajiyah
3313,aduh nyata salah paham islam kafir beda 3 kafir harbi muahid kafir dzimmi
3314,bahas tangkap ikan potas racun sampah plastik bahas tugas tentara nasional indonesia al
3315,anjir
3316,wujud katolik pusat struktur teroganisasi pusat vatikan nu ambil rebut peran sepe i vatikan mudah
3317,bilang orang hina agama kena hukum pidana orang maksud hina agama mayoritas singgung langsung hujat kena hukum
3318,kacung terima perintah terima kritik semoga pimpin simbol kacung kacung kacung kacung terima kacung tunas subur semerbak harum bunga bangkai
3319,rindu soeha o kroni kroni rezim soeha o jual bangsa
3320,rahasia bong koruptor rampok laku maksiat laku bisnis maksiat kaum lgbt jilat dukun sesat dukun cabul nabila bla bla gabung bani cebong
3321,mata buta lihat alam maya hati buta terima cahaya alam
3322,cebong pindah on masuk kemako brigade mobil
3323,serius ngewe sumpah
3324,teroris buddha perintah kerah cyber army bikin hoaks retas akun akun pro rohingya
3325,kamar guru musala kristen doa aula kristen teman kristen a a tolong guru ambil cas laptop
3326,pa ai adil sejahtera pa ai lacur beyek germo pa ai adil sejahtera sadar susilo bambang yudhoyono otak kriminalisasi lhi politik islam khianat prabowo hatta langgar pilih presiden 2014 hancur citra islam 2010 2018 pa ai adil sejahtera susup antek be
3327,dear driver tukar orang anter pintar dongok putar putar cari rumah pakai driver ganti dongok buang banget tunggu tai
3328,maki cebong kaum codot main korban much
3329,baca setan
3330,orang islami bangun narasi tuju beda liberal sekuler munafik antek asing
3331,betah kemarin desak majelis musyawarat rakyat sidang istimewa turun jokowi
3332,mata sipit
3333,normal member autis
3334,najis banget bully adik atip
3335,buaya gede gede
3336,teriak bubar pa ai komunis indonesia orang pulsa listrik rumah habis kutuk orang ketidaktahuannya
3337,tren konsumsi video tumbuh data
3338,lukman hakim saifuddin substansial percaya agama
3339,bajing orang ah
3340,allah mohon cepat ganti presiden biar indonesia selamat
3341,jawa pos paul pogba selebrasi gol dengar tiru suara monyet locator
3342,dukung prabowo surat pemberitahuan arb sda orang orang bejat tabiat kasar masuk orang semoga laknat allah
3343,iya tentara nasional indonesia nafsu banget perintah doktrin karya dukung soekarno bubar parlemen dekrit
3344,bahas ekonomi moral meni deh pakai akun tulis nama antek asing gara gara asing congor negara hina tega
3345,banget alucard
3346,soeha o dalang bencong hehe
3347,bubar komisi berantas korupsi kuat lembaga negara sistem politik
3348,nayeon 9 member kali suka ngepost instagram cerita suka bilang lesbi budak cinta banget kali
3349,tubuh kurus muda orang milik punggung lihat tegap lebar mata sipit tanda kelopak garis wajah lihat gambar watak galak cont
3350,pakcoy pacar kuuu
3351,indosiar elang mahkota teknologi grup gembel siar bola
3352,tampil serasa suci dunia laku setan empati keluarga korban bom kemarin
3353,cebong eh berudu olah ter faith accompli anies calon presiden gubernur hidup tenang nikmat banget main cebong
3354,tau pasukan nasi bungkus kasihan daerah khusus kota daerah khusus kota harap sabar coba
3355,aduh lebay didik soeha o bob hasan menteri kabinet bangun jabat 3 16 maret 1998 21 mei 1998 bob hasan aka muhammad h
3356,kecuali manusia monyet mamalia buta warna
3357,betapa biadab teroris buddha myanmar locator
3358,rupiah haneul suka sepong kontol on retweet
3359,baca onta semoga adik bayi cowok nan modusin haha
3360,mampus tembak banget silvy urus dapur program suka serang debat final pilih kepala daerah jaka a
3361,ngentot sekretaris sexy nurl cerita dewasa memek merah memek basah memek janda
3362,anjing penasaran iya bicara maju garuda kuping budek
3363,bro kitab suci fiksi a i agama wahyu nyata surat pemberitahuan mutlak harfiah filosofis langgar umat agama konstitusi norma agama nista agama kotor ateis mati
3364,sontoloyo sok ipar allah subhanahu wa taala
3365,akibat putus cinta sahabat entot lubang rapat bool memek
3366,deklarasi pilih kepala daerah 2018 aman anti hoaks paguyuban budidaya lele jabon
3367,ahok lantik gubernur anis anis gubernur
3368,780 agama buddha kokoh adab masyarakat bangun candi luas candi sewu prambanan npd anut agama hindu utara bangun candi kalah
3369,keras lawan keras sepe i kung fu kadang pakai tai chi lembut kuat lawan
3370,mulut buaya
3371,hoaks pintar dungu bego kasihan dungu tolol x
3372,urus duit hitung bisnis perintah indonesia untung tepuk tangan buntung risiko rezim model harga janji harga wajar wajar
3373,plakat isi kerja polisi indonesia polisi tionghoa polisi tolak markas lihat foto selamat
3374,bela asma dewi bentuk solidaritas kejam rezim anti islam locator
3375,tolol bela nista agama sangka
3376,minum kopi luwak biar deg degan alias kocak bolot congor
3377,hasil nyata lindung ahok dakwa nista agama
3378,tarik tarik gatot nurmantyo saing jokowi tentara nasional indonesia aktif 2019 prabowo tinggal
3379,debat kampret otak rendam kencing onta
3380,khofifah rupa srikandi nu duduk kursi gubernur jawa timur 2018 damping emil dardak wakil bagus khofifah emil jawa timur
3381,pikir nyeleneh tuhan ku cipta anjing babi kitab haram babi sentuh kulit basah masuk haram akal ku kesana baca
3382,malam pck kerja cocot komersial
3383,mu berita bencong bencong yaelah
3384,tomohon rupa pusat ajar agama kristen katolik khusus doa meditasi bukit kasih buah suci indah tenang tomohon international flower festival nor
3385,lokalisasi agama nu kalah kreatif kristen protestan indonesia kristen jawa batak p
3386,iklan ahok jahat bikin darah didih bangsat penuh propaganda islam radikal
3387,pbb pandang signifikan bagus pasang presiden incumbent lawan gatot nurmantyo yusril
3388,guys presiden blusuk an pelosok negeri jokowi dengar langsung keluh warga a ecek program perintah video pimpin duduk rendah r
3389,warga badui selesai tradisi seba pendopo perintah kabupaten lebak temu gubernur banten wahidin halim sabtu 21 4 seba badui 2018
3390,setan ya
3391,celeng bikin synna emosi mancing
3392,cebong kelojot takjil 2019 ganti presiden waras takjil amuk amuk karuan gilir presiden hina diam 2019 ganti presiden 2019 ganti presiden kacung
3393,kampang
3394,rezim tukang tipu hoaks anti kritik
3395,cebong kopi eta harga harga beli utang
3396,tokoh politik berangan perintah berani bicara kasar etika prabowo berani bilang elite goblok maksud sekolah oi presiden anggota dewan berani bilang menteri agama bangsat
3397,pikir bayi tabung padu sperma kampret onta ragu
3398,monyet sumber hidup
3399,cebong telur 3000an berisik dasar kampret miskin
3400,selamat sore twit 18 4 presiden jokowi pimpin rapat batas ratas istana presiden bogor rabu 18 4 bahas kena cepat laksana usaha online single submission online single submission poin arah simak
3401,selesai impor alat utama sistem tahan brigade mobil mending mundur locator
3402,aww good luck suka pusing bahas budaya populer
3403,nama gatot saptono a l al khaththath status sangka mufakat makar duga dukung anies sandi
3404,jelang pilih kepala daerah perintah kabupaten garut kebut cetak 116 ribu e ka u tanda duduk
3405,iya indonesia hebat indonesia banjir tenaga kerja asing jokowi keren deh top banget presiden umur hidup ayo dukung jokowi solo 2019 ganti presiden
3406,anjing anjing orde tukang tipu malu ustaz
3407,indosat tai
3408,maiyah aman aman hadir maiyah prajurit aman ajar aman nyaman bahagia muhammad sapril
3409,butuh presiden takut miskin ha a hilang kuasa tahta
3410,ayat dingajikan perintah rang bunuh penggal kafir
3411,komunis
3412,
3413,saudara aji semoga allah izin gus ipul mbak puti gubernur wakil gubernur jawa timur
3414,puisi sukmawati puisi sang iblis
3415,jijik kunyuk
3416,otak tara gender telanjang dasar mesum cacat
3417,jam aisya lesbi ioixonemakrab
3418,bismillah superior printing harga ecer lgn polos print ratus puluh ribu lusin lgn polos ratus puluh ribu print 130 ribu bahan rena dri fit pe sp info order pin 5fd97626 wa 081210090063 instagram sri yono bolanet pilih kepala daerah jersey for sale jersey goes to festival thumb
3419,udik kasihan tidur
3420,saksi tani masyarakat ulama perintah dukung program kapal manusia suriah upa 1 000 ton beras ahyudin presiden act yuk simak lengkap video letshe
3421,mesti proyek asing nasionalis pancasilais pilih asing antek asing
3422,a i bacot
3423,nyata tol utang jepang 3 jokowi layak makzul turun jokowi
3424,akulturasi agama daerah niscaya sepe i kristen jawa jalan bareng tradisi jawa istilah kristen nusantara kristen kristen islam islam isl
3425,ajar aji ayat cocok cocok penis penggal kafir pahala biadab
3426,kirim foto kontol full tarik video call
3427,sombong tau he manusia sumber bau bau kaki bau bau udel bau ketek congean korong cileuh bau kepala bau mulut bau karbit jengkol comberan bangkai
3428,layan 2 kontol security meeting room for the video locator
3429,anjing tai goblok idiot bangsat monyet babi fuck kont kangen goblok tau kasar banget maaf
3430,menang anies sandi usut komisi pemelihan daerah khusus kota telat wajar kampanye intimidasi intimidasi
3431,tinggal beli batagor anjir ngaret
3432,e a k mute anjir
3433,bawang asing juragan
3434,mampus anak langsung nongol
3435,oum jodoh pakai pelet jepang dek efektif honda beat honda jazz b
3436,peluang tokoh ubah lukman hidup allah subhanahu wa taala sesat
3437,om jilat memek
3438,anjir ecek kali kali cewek cowok tau tipu video nyata asli cewek lepas gender astaga semoga adek amin
3439,niklan bego pa ai bego pilih bego
3440,acak acak pahlawan siang gagal kudeta pa ai komunis indonesia pakai gelar pahlawan
3441,kubu prabowo nilai negatif bijak jokowi pilih presiden 2019 locator
3442,ngewe
3443,kampang anjing
3444,x9cmbak meeting x9ckatanya a i ajak meeting suruh diam patung miskomunikasi somplak
3445,biaya ambil alih mayoritas saham 51 pt fi us 5 miliar minimum utang perban asing pegang saham mayoritas taro duit bangun smelter murni bangkit listrik biaya x9cdeep cave mini
3446,anies ombudsman wakil ombudsman republik indonesia ombudsman ri ombudsman wak
3447,lebay duda ya
3448,presiden keluh minim publikasi asi games xviii asi games 2018
3449,angkat tradisi budaya rakyat banyuwangi kunci sukses bec 2017
3450,oh iya acara tempo wakil tim sukses anies sandi indra j piliang tukang narkoba
3451,cowok hobi swafoto beda lekong banci kaleng
3452,salah keberserahdirian menteri agama ekspresi tuhan layan sembah sembah
3453,dipungkiri rezim jokowi rezim anti islam
3454,cebong kampret bilang infrastruktur jalan mahal
3455,amerika 200 000 orang pindah agama kristen agama islam
3456,nama sandirawa cundang bubar urus ecek ecek berani urus bantu likuiditas bank indonesia rumah sakit sumber waras
3457,giat bhayangkara bina aman te ib masyarakat aiptu ma in sembiring sambang thomas masyarakat desa labuh labo pesan aman te ib masyarakat anti berita hoaks isu sara benci a jaga situasi aman tenaga kerja asing lapor locator
3458,orang orang sumbu pendek protes prabowo tolak sumbang hadap orang orang rohingya ya
3459,tolak atur perintah ganti undang undang tolak rezim otoriter atur perintah ganti undang undang pintu masuk lengser jokowi
3460,gagal paham kena gagal rangkul cuap cuap gagal paham contoh kelompok 212 kemarin presiden aman aman
3461,mampus jung ruby
3462,tong presiden hina
3463,bicara ahmad dhani monyet babi anjing
3464,cinta buta cinta dengar lihat fakta sepe i kotor kucing coklat prof
3465,mampus kalah lawan
3466,anjir salah tag jennie zumi lisa
3467,apes beneeeer jadwal shift pagi 4 besok off lusa shift malam sabtu badan cungkring ampuuuun zzzzzz
3468,koruptor teroris langgar ham berat koruptor bunuh rakyat pelan rakyat miskin bodoh hilang hak struktur sistematis rakyat gizi lapar dewan wakil rakyat sibuk korupsi
3469,tuju pasang jokowi tuju coblos pasang
3470,batal putus sikap syahrir ubah cegah tokoh pa ai tionghoa indonesia teguh
3471,bunga melati bunga bangkai ya
3472,bubar usir yordania
3473,presiden sistem izin usaha integrasi terap ratas presiden izin usaha integrasi terap
3474,ahok orang nista agama
3475,e i nikmat orang orang sengaja desak desa angkut senggol bokong doang
3476,bacot reza urus anak istri gara gara reply galau
3477,sipit sipit mata barangkali warna beda
3478,pasang jepret racun tikus coba perhati rumah sisa makan sera sampah cecer heran tikus tikus liar tikus masuk rumah tarik bau makan non
3479,dungu km make gelang perkara intimidasi langsung km libat gelang duga bentuk konspirasi
3480,kampung nagita slavina reaksi ayu ting ting locator
3481,pacar agama muslim hindu buddha lucu ya
3482,tragedi 98 nyata salah upaya komunis prabowo
3483,tau jaman megawati korupsi jaman susilo bambang yudhoyono locator
3484,pasang calon gubernur wakil gubernur unggul inews debat kandidat jawa malam
3485,prabowo hormat tampil sepe i orang cemburu kalah
3486,jokowi mundur jenderal bantai 2019 pilih presiden
3487,peang sayang cinta bolot sok pintar lot
3488,sarap bro
3489,lihat salah dukung mafia koruptor nista agama gerombol banci titot laku bidik arah
3490,ngawur rezim indonesia cina negara
3491,retweeted uus rusdiana ciamis asyik ciamis salah 1 kabupaten jawa barat dukung gubernur kang presiden wakil presiden ri nyata putus ms pa ai adil sejahtera
3492,beda banget adi adi lihat bilang berengsek nyha locator
3493,pa ai politik anu usaha keras jegal kesah undang undang takut presiden atur perintah ganti undang undang tarik lihat presiden kasih ancam langsung diam ketok palu tok tok tok
3494,ah bacot dasar sok alim manusia sempurna sok alim orang
3495,gembok akun tebar data kali kali main data data gembok akun 2 kali gembok akun payah cebong cupu
3496,sipit bikin grup
3497,inti kampanye koar koar henti terbit atur gubernur munafik km bilang kampret
3498,kadang kemarin follow tara unfollow follow geblek manusia
3499,11 42 situasi lintas jalan gatot subroto gedung majelis musyawarat rakyat dewan wakil rakyat arah slip pantau ramai lancar
3500,makan siang mi ayam kampus jual layan tonton bareng jojo alah salip alah alah
3501,nyata hafiz tau cebong
3502,ngentot yu rl gampang sange
3503,jam gin ganti baju gembel rumah tanda
3504,km laku patut km laku urus pribadi sel
3505,ayo penjara koruptor sumber waras
3506,sok peduli rohingya
3507,blur kampret
3508,cewek lelaki berengsek guys berengsek bangga a i laki
3509,rupiah anjlok ulah hidup terima isu negatif contoh isu pa ai komunis indonesia tax amnesti wassalam
3510,diam kampang sakit kepala
3511,a i sala cebong pintar pintar nna kampret maju maju otak udang pakai gede badan doang wajar petinggi petinggi kampret pinda haluan
3512,pa ai demokrasi indonesia juang mega bangkit komunis
3513,sadar cacat hasil kerja tim besok day it time to sleep guys
3514,babi sialll
3515,income negara sektor bagus a i negara uang jokowi hutang bangkit ekonomi bangsa paksa hutang pasukan bagus simple
3516,bilang kristen wudhu
3517,x9cnyetir orang mobil gerak idiot windy kesal yoga peka kondisi perut diam tatap
3518,congor persis congor onta
3519,babi anjing mampus kalah jatuh miskin deh bekas sah
3520,presiden uefa dukung hadap usir gianluigi buffon michael oliver
3521,dewan wakil rakyat as a service
3522,warga jawa lupa 2018 ganti gubernur sudirman ida
3523,lupa gereja bom 2 minggu takut pilih ibadah
3524,latih ribet kang bacot mulu kerja x8
3525,moestopo dulunya kuliah rusia pulang huru hara pa ai komunis indonesia agama nama salah
3526,salam ustaz hukum bab jual beli beli jual akad sepe i jual beli
3527,mending jokowi mundur locator
3528,thomas uber cup 2018 rexy tai
3529,bodoh dungu idiot teknis acu orang nilai intelligence quotient 70 psikologi
3530,kena beking tarik solusi berantas nelayan asing tenggelam nelayan kalah singkir usaha
3531,oi manusia homo
3532,gembel fatwa tabi
3533,abg sange telanjang masturbasi bokep indo cumtribute engas memek becek bugil ahok bokep barat cewek seksi pasukan
3534,xa4matanya pejam tunggu tampar terima tampar buah suara asing orang laki laki masuk dengar eeeeeh xa4arra buka
3535,mundur jokowi
3536,pa ai sompret bubar pilih
3537,queen coba memek
3538,prediksi polandia kamis 29 03 2018 nasa 6 3 2 kopi 4 7 9 kepala 8 2 0 5 ekor 3 1 4 n2d86 23 01 54 83 21 04 n3d965 451 cat n8 4 ncm31 62 45 shio ayam monyet twin 11 33 88 nbbfs7 4 1 9 5 locator
3539,salah janji jokowi tuntut paham cebong
3540,komisi menteri hukum hak asasi manusia kena md3 hak imunitas debat undang undang pilih kepala daerah ketok palu presiden atur perintah ganti undang undang md3 presiden tanda tangan
3541,merek yahudi israel us saham owner saham istilah suppo
3542,ajar sumber kitab weda beda tafsir 5 dasar percaya percaya brahman atman karma reinkarnasi moksa nkl ritual raya sembahyang
3543,bilang baca bilang seru alah kirim kampang
3544,negara perang orang orang munafik syiah komunis kuasa
3545,bom peluk
3546,cowok berengsek ya
3547,turun jokowi rezim korban ahok
3548,driver ojek temu keluarga orang pesan ojek langsung tabrak bacot olah olah tukang ojek hina banget
3549,doang bangkai sinyal ganti telkomsel orang miskin
3550,pe ama rezim bijak protes kuasa pura pura dengar paham kritisi a
3551,najis pilih oke lihat lihat kali
3552,jabar mudah mudah tingkat ekonomi masyarakat congratulations geopark ciletuh selamat
3553,pnh kerja asing manfaat terap sekolah dominan enggan
3554,resmi izin program studi s3 islam nusantara program studi s3 konsentrasi islam nusantara indonesia
3555,pilih calon presiden
3556,negara ekonomi surat pemberitahuan republik rakyat cina us jepang utang sewot ri utang berani utang a i negara percaya kelola
3557,beda paham kulit tangkap cina
3558,a i cebong dasar intelligence quotient 200 kolam
3559,sukses bajing
3560,beda institutionalized religion agama diarusutamakan kultus kontrol agama arus utama islam majelis ulama indonesia jaga sesat
3561,sehat jalan jalan aktif tebar sepe i presiden ri manggung kandang bosan ketemu fadli zon
3562,jokowi citra pilih presiden perkara harga saham mahal poin poin prinsip pakat urus pilih presiden metode kerja rezim jokowi sepe i
3563,arah indonesia indonesia kuat 5 dunia bidang ekonomi teknologi militer bidang minimal indonesia peringkat 5 dunia mari dukung presiden ri 2019 2024
3564,ngewe cepat desah doang ngewe knalpot kendara
3565,nasib cebong mimpi orang orang otak berak
3566,dasar cebong xa
3567,freepo 51 indonesia raya manfaat asing
3568,celaka sukmawati tiada e i syariat hidup sesat celaka sukmawati aurat urai buruk wajah celaka sukmawati nyanyi genjer genjer suka iblis sukma celaka sukmawati azan usir iblis sukma sukma mati
3569,cacat anjir nama rambut limbad
3570,oh gara beda langsung pecat rejim anti kritik masuk parlemen
3571,nikah muntah congor pakai acara jijik jijik mampus disabilitas in
3572,tolol sangku paut bilang kecut dasar tolol
3573,budek gendut
3574,lokal merek global bidang agama indonesia hindu nusantara beda hindu dunia hindu nusantara hindu dunia lemah hindu dunia berkem
3575,cina janji kebut proyek kakak cepat jaka a bandung ekonomi
3576,mending jokowi mundur deh negara atur orang menteri anjing
3577,rachmawati soekarno lempar sembako rakyat hati iris anggap rakyat lempar lempar sembako souvenir kaca pimpin ayah beliau laku
3578,simpul bego v
3579,calon calon wakil presiden mud tua bangkai kuat cuit
3580,serang pandang beda bubar komisi berantas korupsi benah komisi berantas korupsi selamat ketua
3581,meteor garden cina
3582,2 nomer indosat pulsa barusan tau pulsa rupiah 0 pakai nuser bangkai
3583,berani ngentot lobang pantat pantat lobang rem
3584,sampah visual kondisi
3585,pa ai komunis indonesia bangkit
3586,allah subhanahu wa taala benci kafir ajar cocok cocok penis istri gemar azab janji rampas
3587,lin iqna karya seni muraqqa album era mongolia iran india pamer depa emen seni islam museum pergamon lin
3588,anjing komunis tolol
3589,orang bodoh percaya prabowo dalang 98 dalang dalang orang jokowi ham 98 jokowi proses know bohong o
3590,monyet universitas didik indonesia hidup yi
3591,adopsi cerdas potensi ekonomi digital capai 23 triliun dolar as
3592,burik
3593,kasih tau bang kasar keset jeyepe sombong tai onta
3594,by the way fase ateis dorong iman tkt ihsan insyaallah goyah hadap bani ateis liberal
3595,cocok langit bumi kampret cebong adem cebong
3596,nyata sikap pilih kepala daerah damai anti hoaks warga desa lae luhung kabupaten dairi
3597,orang mang salah pilih kalah menang rezim sengsara rakyat komunis
3598,berisik salah tokai onta bani cabul
3599,tel gua suka modus gua berengsek gua anak sayang tolong anggap palsu serius tolong main hati
3600,ppp buru buru tolak wacana pilih kepala daerah dewan wakil rakyat daerah
3601,munafik butuh visual tarik non fan we need yireon sakura wonyoung yoonjin jual tampang doang bukti sukses center suara oke
3602,qaumi ekajati conference jamiat ul ulama e hind janab muhammad ali shabb
3603,najis allah seram
3604,suasana hati antuk kena ajar besok exam tikus function kena ampas putus putus kena kasih patah
3605,najis belai jablay
3606,komisi berantas korupsi semrawut goblok bubar c ambang haha haram locator
3607,bangkai om
3608,jalan salib kota ambon potensial objek wisata religius
3609,suruh mundur jokowi bilang zalim gatot
3610,bom wtc minyak irak kabar
3611,orang kiri komunis sosialis marxis mental khianat ajar anti agama buang banding 1 99
3612,gerindra antek orde kkn
3613,ahmad dhani hormat babi anjing kontol lonte tunggu karier mu habis
3614,nete 5 menit anak lulove pingsan
3615,8 anak anak aktivis jabat palestina rencana usir warga palestina area luas mukim ilegal yahudi kefar adumim yerusalem tepi barat
3616,bini senantiasa kurus putih nikah bihun taplak heran laki model n9 tahan sakit derita nyinyir orang urus rumah urus suami lahir anak muntah
3617,cowok ganteng six pack pamer kontol urat kamar locator
3618,presiden joko widodo 34 proyek bangkit listrik mangkrak
3619,hai kampret goblok idiot bin bodoh baca pelihara peet kampret msu sehat turki israel hubung diplomatik locator
3620,goblok kunyuk
3621,jembatan fenomenal pandang fenomenal bravo presiden jokowi bangun jembatan rakyat jokowi
3622,sulit bangsa indonesia informasi jati presiden jokowi chirpstory
3623,komisi berantas korupsi henti bagus dewan wakil rakyat bubar bosuser
3624,asing forever young dengar ulang ulang sial musik video
3625,menteri agama biar tipu muhammad sesuai alquran
3626,cari sumber berita bantu kasih link website resmi bangun bandara rencana groundbreaking 2016 jokowi
3627,ateis kenal tuhan
3628,barel bom wilayah kampus kena
3629,tangkap ahok tuju
