,Tweet
9780,festival palang pintu 13 gelar budaya 2018 5 6 mei 2018 sabtu minggu 08 00 indonesia barat 22 00 indonesia barat tutup jalan jalan raya kemang jaka a selatan informasi telepon wa 0812 8007 9048
9781,benda bodoh pergi beli makan kejap mati perang tau sta locator
9782,calon presiden ri 1 pintar pro orang otoriter
9783,guntur romli al qur an budaya sejarah
9784,waspada izin tambang jelang pilih kepala daerah
9785,naluri banci hilang kawin locator
9786,otak dungu ya
9787,negara bikin legislasi mental mahkamah jalan hukum larang ngewe resmi catet bikin jalan
9788,komedian keren bolot hebat banget bikin dialog dialog sambung dada bingung lawan bicara digakbolotin jago tektoknya allah long life bolot
9789,blok cina rusia syarat korban galau berat indonesia kerja hebat locator
9790,presiden ajak ulama sejuk suasana jelang pilih kepala daerah serentak
9791,azan mulut jamban
9792,hiruk pikuk pilih kepala daerah pilih presiden sejati seteru antek asing barat asing asing juang negara republik indonesia
9793,lengser om dewan wakil rakyat kuasa rakyat berani kawal lengser
9794,and rupa turun mix cina huhu
9795,kerudung transgender makan busuk seram laku wajah sundal bolong zaman now
9796,pro 2 to kampus pagi 10 30 11 30 indonesia barat bahas ekonomi chess competition ecc viii himpun mahasiswa ekonomi bangun himpun mahasiswa ekononmi bangun universitas tanjungpura reza k wiranti c andinia tino sila pa isipasi
9797,tenggelam kunyuk pengkhianat hancur bangsa a locator
9798,rela munafik jumput nikmat dunia bela kuasa zalim
9799,ya allah xl kampret koneksi
9800,pakai licik akun palsu sebar membully akun palsu bunuh karakter orang salah pa ai komunis indonesia orang ateis anti allah agama jenderal nasution waspada komunis
9801,mantap 1 1 1 jokowi cak imin 1 mobil jokowi cak imin 1 acara jokowi cak imin 1 pesawat join 2019 ber 1 indonesia jaya jokowi cak imin 2019 join indonesia
9802,anjr bacot pengantin tendang gaun dayezsah
9803,banget laku mantan berengsek olah olah laku jahat lupa jokowi mantan tau khianat tolak luka locator
9804,babi sial haaaa marah
9805,era yogia undang undang md3 revisi undang undang md2 lembaga daerah dewan wakil rakyat daerah masuk ranah cengkeram pusat isi anggota dewan wakil rakyat daerah masuk pilih nasional daerah b
9806,selamat buka puasa jalan hongkong jumat tunjang raya tai 2d top 80319 cat kuat 88833999 macau 93 83 98 selamat racik sesuai ai mu jp minat bom 2d 3d enam garis inbox bos percaya percaya
9807,tsamara kagum diktator soekarno
9808,alien biru lahir buah kota mewah ayah bunda laku world tour sangka bunda lahir alien kuku palsu lahir tanggal 10 mei 2000 pagi buta berat 2 4 kil
9809,usir duta myanmar kumpul orang buddha indonesia lapang buka adakan orasi locator
9810,sinting locator
9811,pers cerdas bangsa lgbt virus bahaya islam virus bahaya
9812,wakil presiden susilo bambang yudhoyono orang saudagar lumayan sukses
9813,suka nakal pojok
9814,siang rapat batas pimpin presiden publikasi asi games 2018 media lokal internasional kerja sukses event gengsi mohon doa dukung rakyat indonesia
9815,5 kerja abang
9816,lompat 2019 ganti presiden
9817,03 detikspo presiden jokowi sorot minim promosi asi games
9818,bajing inter tim top hebat lazio sampah
9819,sok imut najis
9820,xa4damar rogoh kantung celana cari ponsel warna hitam deteksi xa424 xb0c pondok cina sial xa4cukup sekolah
9821,bupati luwu timur hem thorig husler buka rapat koordinasi forum waspada masyarakat gedung wanita simpurusiang malili rabu 11 04 2018 bupati himbau pa isipasi masyarakat jaga situasi aman te ib masyarakat jelang pilih kepala daerah serentak baca lengkap
9822,kalah soeha o prabowo lawan opini 1998 libat konspirasi global as cina sekutu dukung rencana csis elite katolik radikal konglomerat tionghoa jatuh soeha o
9823,ngentot pacar hotel ngentot anak gede sange toket gede abg bugil tante sepi memek becek tante bugil locator
9824,diktator jokowi jongos organisasi jagal manusia nu andal kampanye kiai tukang tipu
9825,butuh dunia internasional xef kemarin teriak antek asing asing asong kopar kafir xef xef xef
9826,temu rakyat 2019 ganti presiden
9827,alot ifikat halal komponen mikro tengara sentuh babi alami dekomposisi molekular atomik cap haram najis alami proses dekomposisi molekular ramai
9828,lepas bom surabaya aksi teroris susah
9829,henti henti bayang 15 menit cocot orang not easy to talk suruh bercocot 15 menit bilang hem hem hem doang
9830,monyet songong locator
9831,fist travel abu tour gelap uang jamaah umrah leceh diam nini orang
9832,potong tangan bajing pimpin munafik daerah munafik persa syariat cambuk orang pacar doang
9833,warga badui selesai tradisi seba pendopo perintah kabupaten lebak temu gubernur banten wahidin halim sabtu 21 4 seba badui 2018
9834,kader kader pa ai demokrasi indonesia juang nasional demokrat anti islam ulama
9835,mbok batuk orang makan tutup congor
9836,goblok selesai selesai nakal goblok locator
9837,melayu hilang whatsapp yahudi beli haha
9838,jokowi mega calon presiden mundur bikin pa ai
9839,rekrut gus nadir freemason kadung muka agama yahudi ya
9840,sampaoli is sontoloyo pilih higuain icardi
9841,mubazir kodrat 2019 ganti presiden
9842,bolot
9843,masyarakat pribumi san
9844,gak tau man orang pijak kepala but when kepala orang puas hati bodoh
9845,5 posisi seks video tante ngentot cinta kamar mandi tontong lengkap
9846,subhanallah gubernur presiden presiden wali kota
9847,calling for tenant paramabudaya 2018 telkom universitas selamat siang pasar budaya paramabudaya 2018 hadir yuk tarik pasar produk ribu cinta budaya banget langsung daftar daftar
9848,suka bisu tancap kali acuh pandang
9849,bank asing atur atur usaha perintah atur usaha milik saham utang bayar untung freepo
9850,daftar sanata darma yoyaka a nes katolik
9851,agus budek dengar
9852,compile assignment sinting lengan baju
9853,anjir lucu banget animasi dewa
9854,sungguh rezim jokowi sadis kuasa soeha o puluh
9855,mata picek eyeliner
9856,kampret kecoak bikin ribut becus bani cingkrang
9857,istimewa
9858,tanding kroasia lawan rusia drama tegang 120 menit skor 2 2 dukung rusia komunis doa a menang tim kalah adu penalti 4 3 kroasia
9859,cocok bajing
9860,rezim anti islam semangat banget daftar calon pegawai negeri sipil abdi negara anti islam
9861,rizal ramli malu cium kaki jokowi jabat menteri jokowi presiden pecat menteri
9862,usir turun cina tahan pribumi arab usir turun
9863,bangsat pick maksudnyaaa oi jilat anjing
9864,enak enak makan gaji buta uang rakyat modal mulut sampah ri malu
9865,bangga banget labrak nature republik pamer geblek
9866,burik
9867,orang munafik bahaya buu semoga allah lindung
9868,tunggu buaya lobang ya
9869,presiden publikasi asi games 2018
9870,anies bincang salat jumat erdogan warganet gubernur presiden
9871,nyata resmi ketua front bela islam adek armando 1 adek armando orang akademisi laku jahat kotor benci fitnah noda agama ulama
9872,bikin minder pot pipi tumpah berengsek tirus sodor pipi biar tau definisi tembem kamus gambar ide puji hati
9873,hadeeeh sembunyi bangkai cium bau ku ah
9874,asyik pesawat presiden
9875,jurus orang gila kebut lalat aji tatar bayu jurus kunyuk lempar buah dewa tidur matahari aji rogoh sukma siul kapak naga api 212 kalah dewi siluman bukit tunggul wiro sableng sableng nuser nuser locator
9876,mentari pagi agama kristen pagi umat nasrani lagu lagu nasrani hadir
9877,habis gelap terbit terang road to 2019 ganti presiden ka 2018
9878,bacot gaya otak timpang
9879,aseeqqqq oppa oppa sipit
9880,kasar cocot ki
9881,golong 1a halina kawin robi rekan frustasi golong 2a beli mangga campur sirup barium radium lupa golong 3a intel golong 4a ceri gendut puber
9882,cina usir zaman belanda tukang pengkhianat
9883,oh geblek auto nyanyi
9884,rakyat dukung komisi berantas korupsi ri usut tuntas anies sandi anggota dewan wakil rakyat amien rais kuasa elite politik libat korupsi
9885,untung bantai warga ahmadiyah jokowi salah
9886,agama kedok tipu kali polisi hasil tangkap pasang suami istri nilai tipu 5 000 jemaah bawa kabur uang rupiah 100 miliar sosok
9887,ustad pasar senin om hitung hitung cerah jual bawang putih cina halal
9888,bajing rampok negara
9889,oh cinta dukung presiden permadani ali sera cebong kampreter cantik x8
9890,mbah saleh ketua dewan wakil rakyat budaya identik seni jaka a ketua dewan wakil rakyat bambang soesatyo bambang soesatyo perintah
9891,bicara orang berak
9892,a ikel isi an 2019 ganti presiden
9893,aher istri om om indonesia lawyers club kemarin ganti presiden oh mardani istri ketua pa ai adil sejahtera presiden pa ai adil sejahtera istri
9894,pa ai demokrasi indonesia juang nasional demokrat bicara ganyang pa ai komunis indonesia memble
9895,ajar slow living organik and vegan gaya hidup urban farming life manajemen prancis bikin sadar indonesia budaya utama budaya terima balance syukur mas
9896,universitas sepe i titip mata mata rezim awas giat mahasiswa aneh rezim
9897,bantah photo bukti komunikasi sambung 2 pimpin
9898,teriak anti asing asing fadli zon teman donald trump fadli zon mental munafik
9899,1 mata sipit orang korea n2 keluarga n3 my suara n4 badan bilang ideal v n5 army i love my everything my life my bts x9
9900,rejim rakyat
9901,bagus p ha o rumah pakai bahasa indonesia bagus bagus pondok indah bintaro jaya kota wisata pakai bahas asing residen desa hill hhhhh hancur harga bahasa
9902,anies sandi haha ter bongkar wajah asli saracen
9903,haha main media sosial dungu dasar kecebong
9904,baca tai spam kado locator
9905,mundur sanggup makmur rakyat
9906,selamat natal hehe dasar admin bolot
9907,innalillahi ilaihi rojiun keluarga nahdlatul ulama duka cita wafat kiai kholilurrahman ra lilur cicit syaikhona kholil bangkal semoga allah rahmat ra lilur sisi amin
9908,aneh orang orang geblek habib rizieq shihab berani komentar anggap guru berani gendeng tolong deh habib rizieq dukung hina guru dasar fira
9909,memek gatal ngentot pakai kontol keker
9910,kuat hadap bacot sumpah kuat
9911,ungsi asing ungsi asing dodol
9912,mending bubar bikin lembaga anti korupsi paradigma bebas
9913,13 pakat karakteristik pribadi cermat kondisi faktual internal susilo bambang yudhoyono susilo bambang yudhoyono taipan ha a limpah
9914,al fatihah
9915,butuh memek hubung rupiah haneul
9916,najis mahal mahal
9917,for me kucing cacat is the precious gift event sempurna but they r cute in their own way comel kucing xb
9918,mantap mahmud kontol muncrat kapok tante bo locator
9919,nuser nuser kunyuk tindak perintah jokowi lemah nuser
9920,sherlock holmes idiot geraham bel bodoh detektif temu telepon orang temu jenius ya
9921,lelah amin doa lelah cacat ibadah semoga dunia surga
9922,tuan guru bajang presiden nusantara for indonesia for rakyat
9923,istilah kopar lapor pa ai komunis indonesia asing asing pria no pria sejati negara republik indonesia
9924,menteri soeha o homo
9925,malu presiden korup era soeha o susilo bambang yudhoyono
9926,tunggu hoshi sipit tunggu woozi mingyu sepe i
9927,angkara komunis mustahil mahathir pm
9928,jokowi tunggu 2019 2017 lengser konstitusi hehe
9929,tuan guru bajang dukung jokowi 2 periode kaum bani micin kaum bumi datar kejang kejang
9930,prabowo mimpi ri 1 mustahil mimpi siang bolong mas piyu sakit mimpi
9931,halo selamat siang tinggal putar minyak produk jalan kunti street minyak
9932,ubah total anti asing asing cinta asing asing
9933,harga saudara pilih orang ateis tipe orang hak lurus mata orang beda be
9934,jaman susilo bambang yudhoyono korupsi proyek mangkrak penak mbah
9935,fokus kang menang pasang asyik gubernur jabar abai asyik menang aher indonesia
9936,ahok paham pb bahan serang p jokowi kelompok bani togel 212 kang surat pemberitahuan remisi napi 1 teroris koruptor narkoba kang p ahok bebas murni
9937,presiden kampung sambut riah tukul kampung sambut riah gede sambut rakyat bangga rakyat indah budaya gede ganti presiden
9938,komisi berantas korupsi mimpi berantas korupsi orang sangka koruptor
9939,guru desa sei kanan deklarasi anti hoaks pilih kepala daerah 2018 damai
9940,indonesia serah asing
9941,prank level tai anjing locator
9942,rohingya muslim rescued at sea off sumatra indonesia ekspat
9943,bangkai mas
9944,pasang calon bagus 2 pasang calon cenderung konflik akar rumput buka sadar pt 20 susilo bambang yudhoyono kuasa pojok koalisi dukung jokowi a i mata kakak
9945,jual badan usaha milik negara migas energi beli freepo bang jual cebong cebong indonesia pintar pintar lucu lucu
9946,gaji 3 juta prabowo presiden 6 juta pikir maju sekolah kerja giat salah jokowi ustad provokator
9947,eh karcis parkir pegang ah tai serius mal
9948,larang ajar komunisme sisi perintah buka pintu masuk wisatawan komunis negeri
9949,tarik gacha dantori kampret daya habis
9950,ronaldo pardede siswa kelas 5 sekolah dasar katolik karya yosef
9951,cewek jago ngentot berondong cakap bikin tante nafsu cari berondong locator
9952,aceh usir gubernur kalimantan manado usir anggota dewan jaka a usir arab usir cina asyik tren usir usir
9953,lgbt musnah golong libat rasuah salah kuasa musnah bangsa negara tahap bahaya dosa harap sibuk rang lbgt tutup mata mungkar men
9954,agama islam agama samawi bahasa arab a i langit agama samawi bangun dasar wahyu tuhan malaikat jibril nabi rasul tulis kitab suci kitab suci alquran
9955,rapat koordinasi kembang bandara plt gubernur jawa hadir presiden ri purbalingga
9956,te ib presiden
9957,cepat hebat lambat cacat stop comparing my self to other
9958,maaf kang kopi bareng fahri lari negeri
9959,yesus kristus suka bikin orang percaya hidup miskin derita hem berengsek tuhan
9960,calon wakil presiden gempar bani oposan nama juragan ganti cebong kampret cerita
9961,harap pe amina saing usaha minyak dunia negeri tahan direktur utama tanda nasib bikin teken proyek kilang minyak realisasi cepat 3 nasehat duduk manis bikin
9962,raih matre bayar fakta dasar banci potong fukonserawlex locator
9963,jilboobs pintar sepong kontol hijab sange emut anu jilbab cantik coli colok memek bokep mesum viral
9964,antek asing impor cina usung pa ai adil sejahtera gera indonesia raya pa ai gera munaspil ketua
9965,indonesia 1 vietnam 0
9966,mampus sangkut om om
9967,jawa gereja kristen jawa gereja kristen jawa ajar bahasa jawa campur ajar kejawen budaya lokal rugi rugi
9968,nyali gubernur indonesia uji beliau berani lawan konglomerat konglomerat hitam gubernur berani rakyat daya 2019 ganti presiden
9969,ganti jokowi prabowo
9970,kristen nusantara iring budaya agama jalan budaya lokal lestari
9971,masya allah dungu makan tahi jokowi era negeri rusuh rupiah sepe i hutang ln sepe i aset bangsa jual sepe i bangun tol ambruk
9972,aksi turun jokowi biar selamat indonesia malu calon presiden
9973,bentar ulang unn kirim rombong topeng monyet raya
9974,kerja seks komersial campur lepas kerudung kerja seks komersial baca twit fahri benci jokowi balas jokowi presiden maki maki orang fahri twit fahri penuh
9975,jotef hitam berengsek 0
9976,dasar gila
9977,uang negara ustad sembako incumbent uang negara rezim bangsat
9978,tradisi katolik raya ekaristi misa nuansa daerah nama misa enkulturasi imlek misa inkulturasi tionghoa
9979,lucu woozi tuyul lucu tuyul xb
9980,masuk kerja mencret capai kemarin
9981,tag polisi republik indonesia anjing tolol banget sumpah
9982,
9983,anak muda luap luap semangat bebas paham konservatif ranah burhanuddin al helmy jaya presiden tewas ustaz abbas alias
9984,maksud domba idiot akun
9985,ustad bicara bahasa mbokne jancuk mata picek jamin 100 ustad abal abal
9986,nyata ketapang kalimantan barat masuk wilayah kerja polisi cina nini bahaya aman nasional ri tau rezim rezim kuasa cina tanam pengaruh buruk 2019 ganti presiden
9987,lupa twitter instagram foto komen cantik cantik cantik anjing cantik tau babi cantik pokok
9988,grace uap lebar mata sipit sipit hem pulang antuk
9989,cebong dongokkkk
9990,alah kubu muslim orang tuhan hitung nomer takut kena serang jantung p
9991,cebong cina komunis cinta jamban
9992,ganyang pa ai komunis indonesia waspada bahaya laten
9993,a i banci randa
9994,anies doa amanah istikamah jalan tugas gubernur daerah khusus kota jaka a
9995,ganti presiden 2019 via locator
9996,ejek bacot ngentot nikah ajak ngewe
9997,pantat
9998,beli tol otomatis tarik duit tol beli tol asing asing a i asing asing pakai kuno
9999,gila kids jaman jigeum sungguh bahagia umur 10 main taplak gunung
10000,sandi bilang bully pakai asing asing butuh negara masuk cina
10001,masyaallah antek antek muncul wehhh lini ku
10002,pergi mampus benda kinda suasana hati
10003,gede pipi mata sipit hem
10004,usir bakar lilin aksi bineka aksi teroris cina bukti mata sipit pegang lilin
10005,produk gagal beli cundang om sedia kaos tim negara negara onta payah bikin tau selera pasar
10006,lihat agama mayoritas tindas aniaya a i indonesia
10007,suka nete km
10008,buku lawas ilmu agama muhammad hatta 1983 36 halaman harga 125 000 minat
10009,baju nikah pamer paviliun baju melambang waris tradisi budaya kasih
10010,presiden ri megawati soekarno putri unjung pamer arsip konferensi asia afrika kakak 63 kakak langsung selasa rabu 17 18 4 widya graha lembaga ilmu indonesia jaka a selatan megawati delegasi muda konferensi
10011,cinta budaya lokal a i kampung cinta budaya barat a i barat barat lagu timur barat selatan utara lagu wali
10012,bubar dewan wakil rakyat asli negara jalan
10013,orang kawal hidup bodoh pandai
10014,bacot
10015,punuk onta sombong sok tau
10016,diam setan
10017,kwsp sumber rm114 56 miliar
10018,mesum warga suruh haha kocok emut kontol puret tegang
10019,cape bego teman teman diskusi uji
10020,barat gereja kristen masyarakat trauma ragu agama
10021,monyet songong locator
10022,gila sinar light laser rajam hidup orang cacat kulit community dukun tata endah sign indonesia raya rendah ma abat hidup orang penuh kenistaaan hidup orang orang media
10023,ambil referensi status facebook twitter instagram no kontak alas lupa bangsa tolol maju maju
10024,mending nete bu joy
10025,habis minum kencing onta
10026,tuju percaya gosip 2019 ganti presiden
10027,mata picek babang
10028,sekolah jumat jumat foto kelas sekolah buku gembel foto kelas tema bebas
10029,nyata sudut perintah sungguh naif munafik hidup manusia tau terima kasih balas budi tolol
10030,muslim jabat negara wajib dampak buruk aji salat
10031,puisi kampung bodoh ilmu dunia bodoh ilmu agama innalillahi
10032,dunia muslim bantai umat
10033,he sinting locator
10034,ku muka umur 16 literally kentang mulus bersih cacat surat pemberitahuan bilang can t relate skincare simpel fw banget
10035,sipit sipit bantat seungmin
10036,dengar bocah khayal mimpi basah komentar ulah anak orang ayo bocah presiden hina
10037,kang fakta pa ai dukung nista agama benci rakyat masuk rakyat jabar locator
10038,te awa anjing serius pikir maki salah taeyong mulu canda doang
10039,prestasi ahok mafia koruptor nista agama hasil tenggelam jaka a congor cebong
10040,budaya lepas kodok ikan burung budaya cina kuno jujur rakyat indonesia 2019 ganti presiden
10041,gubernur daerah khusus kota jaka a anies baswedan temu presiden turki resep tayib erdogan tunai salat jumat mesjid sultan ayub istanbul turki jumat
10042,cebong main kolam tau tanggap cebong nongol dasar kolam butek
10043,monyet komunis tolol
10044,lupa malam jum at habis pencar tuyul
10045,maaf dukun sibuk bakar menyan bani kampret
10046,ayo lengser joko
10047,2 suka cepat ekspres 1 sms notifikasi pemberitahuan no resi lacak paket barang kirim 2 barang paket kirim cepat aman cacat cepat kualitas
10048,cuap cuap hebat salah a i promosi susilo bambang yudhoyono sampah will see
10049,kucing rumah kakak kerja makan tidur main tai pipis rang
10050,neo komunis antek cina sebentar musnah negeri
10051,makase fren fren ku duduk tai kucing kunci motor tilap binasa
10052,orang orang budek tuli pekak tolol
10053,sembako gembar gembor nama presiden utang diam diam nama rakyat 2019 ganti presiden 2019 presiden 2019 ganti presiden
10054,lihat lokasi muhammad bantai 800 yahudi 1400 lukman
10055,gubernur presiden
10056,klik
10057,ganti presiden harap cek sehat benci deh hidup buruk jumpa kelompok terbang jokowi 2019 jokowi 2019 t3
10058,astagfirullah allah hamba setan kutuk
10059,budek ya
10060,diktaktor otoriter presiden
10061,mampus a
10062,nete abang 3 ggg
10063,lurus depresi suicide teman tuhan bodoh cape
10064,menteri sontoloyo
10065,salah orang baca 3 ayat salat onta hamil gemuk muslim
10066,ayo zul kritik
10067,kurikulum cinta indonesia hapus ganti kurikulum cinta cina
10068,hehe dungu otak km susah km anak ingus tumbuh e i nete dasar kadal kebun
10069,sadar bom takjil malang facepalm
10070,e i pola pikir orang tua suruh anak teman autis manusia jahat banget sepe i pintar
10071,turun pa ai komunis indonesia marah
10072,cacat mbappe
10073,presiden gelar rapat kabinet batas agenda bahas cepat laksana usaha i
10074,kafir musuh munafik bunuh
10075,rejim muncul istilah mesjid radikal syiah komunis liberal
10076,selamat siang ngentot yuk jumat ngentot memek memek locator
10077,polisi daerah jawa aman pilih kepala daerah 2018
10078,syarat calon wakil presiden jokowi 2019 aju ppp salah jaga narasi bangsa indonesia indonesia pimpin gabung narasi nasionalis agam agam nasionalis romahurmuziy
10079,komisi menteri hukum hak asasi manusia kena md3 hak imunitas debat undang undang pilih kepala daerah ketok palu presiden atur perintah ganti undang undang md3 presiden atur perintah ganti undang undang tanda tangan
10080,panglima tentara nasional indonesia pemuda pimpin bangsa
10081,sitip
10082,dewan wakil rakyat butuh dukung hak nyata lengser jokowi daulat tangan rakyat serah rakyat
10083,juragan kisah bunga hangat course haha pikir natural killer detail gera member tahap gila tahap natural killer tepi kain orang but i sweet stalker cantik and pintar
10084,selingkuh risih pandai simpan bangkai cium bukti
10085,memek eh mewek
10086,mampus
10087,jokowi antek zionis komunis paranoid islam locator
10088,gawat ketimbang perintah kecele kali kali kerja usaha asing freepo 51
10089,memek lonte sodok kontol gede
10090,12 presiden harap skema kerja laku bangun bangun
10091,buka ekspektasi flasback bahas ngegoblokin laku sekolah biar have fun realitanya bahas kerja sombong anggap kerja kontol bangsat dasar adit fajar ilmiah
10092,udik gay
10093,bangkai ketuk jendela
10094,dakwa nista agama alias ahok babi jamban morfin uang rakyat jaka a
10095,suka iri orang orang rahasia kulit mulus air wudhu kristen
10096,orang indonesia jabat tingggi negara republik indonesia salam bahasa orang arab bahasa indonesia rendah
10097,pakai jurus tenaga kerja asing kali lokal habis pecat pelan pelan
10098,heran setan iblis kabur takut dengar azan makhluk allah anteng
10099,ekor monyet kebun binatang tianjin cina viral milik wajah sepe i manusia monyet usia 18 jenis capuchin amerika locator
10100,dukung aye diam diam kagum duet jokowi puan calon presiden calon wakil presiden sumpah 2019 ganti presiden
10101,pb wibowo gay ya
10102,kali bolot
10103,ah pekan tai
10104,teman budak antek
10105,warganet nilai jonru rugi rakyat jokowi locator
10106,islam nusantara produk jil pasar gencar antek jil jil anti arab pro asing almarhum kh hasyim muzadi jil kafir kafir umat islam
10107,sayang gendut ulang gila tua umur puluh asyik cepat ketemu salihah sepe i harap semoga tinggal xef
10108,jokowi tuduh pa ai komunis indonesia prabowo tuduh otoriter halo mas agus harimu i yudhoyono senyum senyum kumpul kuat politik haha
10109,bunda pro banget goyang kontol suami private bun x82g bosan lihat video kasih biar vera lihat nhtt
10110,abang bahasa asing basa asing no no basa inggris dek basa asing
10111,era susilo bambang yudhoyono alat libas lawan komplot
10112,kang lengser jokowi kerja pikir infrastruktur pikir rakyat nyaman ekonomi stabil
10113,berengsek banget kirim foto setan
10114,andre onta mate hajar
10115,enak entot kontol locator
10116,weh kunyuk
10117,gila panas nutrisari jeruk amerika idiot keringetan
10118,tg rupiah nitrogliserin sori orang orang sadar etik banci taksir cemburu hdh
10119,jablay cari perhati tulang tulang cih in ah
10120,ustaz subki al bughury sos i dukung pilih kepala daerah damai kabupaten sinjai hoaks benci isu sara
10121,ayo agama mu kristen protestan ateis buddha hindu malu agama
10122,basah memek entot
10123,cebong bani bumi datar
10124,culun orang bekal mimpi minat ketrampilan
10125,cewek tolol deh gara gara cinta rela hormat
10126,darurat dunia adil indonesia adil negeri ajang benci sara dakwa iman hakim iman ringan hukum beda agama hukum berat berat kecuali sogok pakai duit adil indonesia
10127,i added a video to a playlist
10128,cebong ahli bully ahli bully gerombol kampret panik temu sosok ganti jokowi a i jokowi wajib 2 periode
10129,memek nikmat ku suka
10130,kasihan bata bata bicara lupa bawa teks perhati hormat sukses anies
10131,wagirin arman apresiasi usul pilih kepala daerah pilih dewan wakil rakyat daerah
10132,berengsek tobat video bokep muncul kutuk boy nge in
10133,he su anjing sehat
10134,untung goblok alias pintar orok v
10135,pa ai tolol indonesia pimpin kafir catet
10136,dungu dukung prabowo cong serang hadehhh dasar banci ya
10137,prabowo musuh pa ai komunis indonesia antek antek locator
10138,banding n4d n4d talenta banget panjat sosial banget najis
10139,ganyang pa ai komunis indonesia hapus lambang pa ai komunis indonesia film intimidasi komunis antek pa ai komunis indonesia sepe i hantu
10140,kampret jimmy duit tiru ulama ulama goblok goblokan goblok bin bahlul copot atribut atribut palsu ganti seragam cebong mati sengsara azab allah amin lihat
10141,heran warga daerah khusus kota pilih kepala daerah ribut mayat gubernur ribut mayat salah allah takdir tolol isi ulang
10142,mang ka u tanda duduk tulis cebong mas butuh perhati kasih sayang
10143,duga sedia kerja seks komersial warung kopi kabupaten tangerang tutup xa0polisi uniform locator
10144,harap maklum isu toku idiot
