,Tweet
6515,lt kepala pening istilah psikologi buka mesin cari e i a i asing senang kerja tugas
6516,kristen simpan mp3nya handphone
6517,lidah buaya
6518,tolak hoaks sukses pilih kepala daerah damai kota
6519,beda tingkat intelektualitasnya temu orang 2019 ganti presiden
6520,sebar ekonomi makmur jamin terap adil madura pusat ekonomi syariat jawa timur saudara makmur gus ipul mbak puti saudara makmur jawa timur saudara satria muda
6521,curi samping lelaki sekolah agama
6522,kasiter a musyawarah pimpin daerah tinjau sasar fisik tentara nasional indonesia manunggal bangun desa 102 komando distrik militer 1709 nyawa sasar tentara nasional indonesia manunggal bangun desa upa bangun 14 unit rumah tipe 56 2 unit didik anak usia kamp cina tua bangun 13 unit rumah kampung tuap 1 unit rumah kampung serui laut pasir puti
6523,kristen nusantara gereja gereja kristen jawa gereja kristen jawa
6524,akun sisa checkout minggu habis anjir belanja
6525,goblok alumni 212 sampah
6526,ronaldo pardede siswa katolik santo petrus kelas 1a 2b 3c 1984 1987
6527,ambang tai jir
6528,memek basah mas
6529,buddha bunuh islam myanmar
6530,700 rumah masjid rohingya bakar teroris buddha 14 9
6531,imajinasi jebi modar tabrak meteor
6532,aktivis cegah hiv aids duga kerja seks komersial elmo pindah jayawijaya locator
6533,bodoh sial anak anjinggg maju setan sweater mansoura
6534,duh istilah pepatah tiada kenal mk tiada sayang pucuk cinta ulam jodoh
6535,juragan silit
6536,bhayangkara bina aman te ib masyarakat polisi sektor campaka sambang warga sosialisasi anti hoaks jelang pilih kepala daerah
6537,su pin siswi sekolah dasar katolik karya yosef kelas 6b 1983 istri ronaldo pardede sah
6538,alumni demo bawang asing impor
6539,admin bahas ekonomi hutang negara defisit bocor ajar ekonomi ajar beda uang as uang koin uang ka al uang giral
6540,gus ipul mbak puti komitmen tingkat perhati kaum anak gus ipul puti 2
6541,hasil sodor prestasi tokoh prestasi pa ai muncul aksi jelek jelek lawan kasihan manis bego alat syahwat kuasa
6542,hijrah lambat cebong
6543,kaku lagak gila corak cuba orak gerak ramai
6544,gih kebun binatang kandang buaya
6545,aneh rezim rakyat pintar mas bro terima kasih media sosial
6546,niaga katering makan tempah kursus kursus hadir agama hindu vegeterian kali sedia menu 2 3 orang tunggu orang hormat
6547,dewan wakil rakyat bubar fungsi habis anggar ladang korupsi uang mahar
6548,mundur pecat untung gatot lus
6549,teduh tensi pilih kepala daerah ulama nyata dukung jokowi calon presiden rakyat jokowi 2019
6550,pakai syariat islam gantung manusia laku negara negara ateis korupsi minim plus hidup damai sejahtera
6551,ngewe ayo
6552,bong dengar jerit tani dengar jerit tani garam bolot akut perata maksud bong mohon kerak otak lumpur ira
6553,a is pilih kepala daerah jawa timur a is a is kota jawa timur kumpul musim pilih kepala daerah a is dangdut dulang suara f off air fildan
6554,kitab hina lapor polisi munafik hubung waspada cebong kafir islam
6555,tuhan jalan buku sulung embara tegar khairul jamain embara aktivis falsafah alam politik ekonomi budaya cinta tuhan jalan temu booth 4003 4004 dewan tun razak 4 pesta buku bangsa kuala lumpur 2018 27 apr 6 mei 20
6556,bantah goblok
6557,negeri selamat 1 syarat lengser jokowi jaga negara republik indonesia selamat negeri
6558,mentang mentang kuasa ambil wenang yudisial sarap
6559,lesbi celaka locator
6560,jablay pro ajar langsung pap tete pap tete
6561,laku ahok sukmawati joshua ge pamungkas ramai kandung unsur nista agama nista agama
6562,kasihan warga daerah khusus kota php lantik anies batal janji kampanye locator
6563,usir buddha indonesia diam lihat bantai locator
6564,keluarga presiden indonesia keluarga prioritas kisah
6565,3 kali calon presiden 3 kali gagal tolol nama
6566,kampret kejam a i simbolis benderang tidur siang kepala melek cari mangsa gelap malam
6567,mbak mbak mas mas ulas sejarah pancasila negara bentuk pancasila pa ai komunis indonesia a i pa ai komunis indonesia tuhan
6568,mari tonton pa ai bangkit bangsa pa ai kebelet banget lawan ppp pa ai pepet presiden menang
6569,masyaallah indah lihat tokoh allahu akbar
6570,situs sangir jawa luas puluh delapan kilometer persegi unesco daftar waris budaya dunia 1996
6571,kabur main dongok tribun kosong panjat haha ah payah kontol kontol haha
6572,ayah oku tangan kiri cacat alhamdulillah kerja handle syukur ayah istimewa
6573,golong asing untung tolong sepuh pasar gambar buah peta sederhana pandu telusur lingkung takut sesat
6574,kang aher hasil ka u lindung sosial bandara internasional jawa barat tingkat ekonomi rakyat jabar bangun generasi milenial nyata
6575,abg generasi micin hafal gesek kontol memek nikmat locator
6576,sitip sitip
6577,lengser jokowi biar lihat goblok
6578,mahasiswa kocak modus rakyat indonesia 250 juta 25 orang sontoloyo
6579,titit titit hambur
6580,hyunjin kejar kejar film hollywood lempar bom
6581,lesbi anggap salah salah cinta maaf normal tanggap lesbi gay bisexual salah hidup damping orang orang pandang belah
6582,junjung jam 1 bilang gebuk jam 1 15 sweeping pa ai komunis indonesia
6583,muslim menteri agama wajib jujur isi alquran
6584,kang sudrajat syaikhona dukung ulama jawa barat insyaallah gubernur jabar 2019 2024 sudrajat syaikhona nomor jawa barat asyik pilih prabowo jawa barat
6585,eh pa ai komunis indonesia miband haha tinggal zaman jam besi mira
6586,edan pbg purwoke o ngeles
6587,ya kasihan cewek cewek tonton bokep lihat atlet buka baju langsung sange
6588,ngentot enak crot
6589,anggota dewan wakil rakyat potong
6590,iya negara pimpin orang paham kelola negara lengser jokowi
6591,chadli cacat mala dembele ganti cacat
6592,komisi berantas korupsi periksa gubernur calon wakil gubernur sumatra utara ijeck sah
6593,ruhut prabowo strok fadli zon ruhut gila indonesia lawyers club prabowo serang
6594,wooyyy anjing lacur laku bejat dasar anak haram
6595,bahan bahas 5 showtime doang acara 3 makhluk kampret heboh fan belas sinting
6596,buku lawas peran agama moral bangun masyarakat ekonomi indonesia syafruddin prawinegara 1966 32 harga 150 000 minat
6597,njinggg bencong gaya pakai blok blok wa
6598,ceramah kalang internal muka agama mengkhutbahkan istilah kafir non muslim agama islam domba sesat agama kristen dogma agama
6599,cewek lelaki berengsek guys berengsek bangga a i laki
6600,provinsi gorontalo visi misi gubernur sektor ikan laut salah program prioritas tingkat ekonomi rakyat bangun sektor ikan laut harap
6601,pulang mama pacar suruh main kesini alah anak gila gila orang kuriahh
6602,adakan nyanyi district jablay
6603,ya ampun adem banget saudari fungsionaris
6604,headline transaksi tunai batas maksimal rupiah 100 juta ekonomi ganggu
6605,freepo ganggu gugat rezim orde bikin janji abadi
6606,x maksud rg al alquran al alquran kitab suci x maksud ahok maksud nista agama x oi bohong dasar kafir
6607,gubernur indonesia
6608,besok prabowo calon presiden teriak teriak negara republik indonesia harga mati percaya ya
6609,ogah presiden kacung orang presiden kacung
6610,rakyat curiga rezim anti islam locator
6611,rakyat hidup susah rezim jokowi rusia
6612,berak
6613,lihat setan takut tau setan cari saudara xcb xcb goblok ketik ketik
6614,pakai rohingya serang
6615,kadang umur rokok orang tua b bicara bicara bicara anjing kontol marah
6616,haha mampus selamat galau ria
6617,berani bilang isu saracen goreng serang lawan lawan jokowi
6618,kampung dukung agus harimu i yudhoyono
6619,warga semarang prihatin kontroversi puisi gus mus
6620,model seksi ngentot pret detail fr bule
6621,persetan bocah kontol sok rad kecewa sekolah ganti nama sok mes tong biar coba sekolah kerja pacar tidur jajan sok sok an bilang harga
6622,layak bubar mari referendum rakyat bubar dewan wakil rakyat
6623,setan rusak diet
6624,lapor a i fix gerbong
6625,kampret
6626,terima putus presiden pa ai komunis indonesia muncul gebuk
6627,minggu pe ama digitasi minggu rektifikasi proses pbb layouting pbb senang kp ajar map info global mapper arcgis autocad cacat apps
6628,aduh mata sipit banget im not a cina myself aduh sabar adik
6629,terima kasih gubernur puji
6630,islam pakai huruf gede tenang buta mata buta hati hilang nurani pilih pilih adil kecuali e i makna adil
6631,indonesia palsu tanah lacur
6632,tim 1 pakai usaha produce orang 0 titik tim 2 perform lancar cacat lihat darimanapun tim 1 bagus men
6633,presiden jongos tunggu aba tuan cina bantai muslim cina kafir
6634,bani kampret otak micin om bud perintah mesti duit freepo habis kontrak om bud bantu
6635,lengkap video kitab suci fiksi nista agama nama
6636,gus dur sikap orang pimpin muslim ramah idealis cinta beda pluralisme keren
6637,mantap
6638,salah jokowi rezim jahat diktator otoriter komunis kafir zalim organisasi papua merdeka locator
6639,nama
6640,komunis keren
6641,untung presiden jokowi beliau bandara mangkrak jalan terima kasih presiden salam 2 periode
6642,kepala unit bina masyarakat inspektur polisi mt hutasoit laksana sambang pesan pesan aman te ib masyarakat pilih gubernur pilih kepala daerah 2018 karyawan bank rakyat indonesia ranting muara damenra silit kawan kawan desa hutanagodang camat muara kabupaten tap utara
6643,isu terpa sepe i feminisme rasialisme lgbt film mulan frozen remake live action cantik and the beast salah kuat film animasi disney lagu lagu bikin tonton sing along senang
6644,seriawan hamid marah nilai presiden jajar potensi pengkhianat bangsa kutuk kelak petaka negeri
6645,rezim plonga plongo kacung cina plonga plongo dungu haha
6646,bom jiah
6647,jalan sipit tinggal
6648,gubernur bangga bangsa indonesia
6649,i added a video to a playlist
6650,bangkai habis putus ngiang ngiang mandi kucing eeeeeee
6651,haha bikin tonton sarap sepe i dad main main gitar
6652,jokowi anti islam usung lawan lawan politik buzzer rezim
6653,barometer terang pilih kepala daerah daerah khusus kota tahan 60 tumbang kotak pilih hasil gubernur bawa rahmat
6654,dedah x9cluka x9ccacat
6655,ngeles om anies sandi
6656,allah subhanahu wa taala paham toleransi buang ajar toleransi indonesia gabung sabang merauke 2016
6657,sedih makan siang lihat sendok pasang garpu taplak pasang
6658,banget rezim anti islam anti ulama bukti locator
6659,cupu bawa bawa squad
6660,tuju usir turun arab india cina masuk zul locator
6661,dokumen hasil tim cari fakta munir hilang hilang nyali politik jokowi era mega
6662,ayas kunyuk
6663,badan awas pilih nyata pa ai adil indonesia lolos penuh syarat pilih kepala daerah 2019 liput 6 sctv
6664,2 presiden indonesia negara kokoh kuat ulama umara iring a jaga tali silaturahmi jokowi ajak ulama sejuk pilih kepala daerah
6665,cepat jijik woi tahan napas kejar kejar
6666,es degan negara duta israel jalin hubung diplomatik jokowi jalin hubung diplomat es degan antek yahudi
6667,salut ikhlas sedekah habis dana miliar
6668,kunjung anies turki tuai puji ribu warganet gubernur presiden lengkap
6669,kutuk
6670,hebat ukur kadar iman orang kadar lihat golong orang picek mata hati
6671,orang gila ganggu mental orang logis
6672,somad minum kopi starbucks mad somad minum kopi ayo entar tampar cocot biar monyong
6673,ganti presiden calon
6674,deklarasi pilih kepala daerah 2018 aman anti hoaks warga panggreh jabon
6675,2 teriak teriak jokowi diktator teriak hidup nyaman ironis
6676,sinting main sepak bola jual bahan kimia locator
6677,uji sekolah sekolah dasar didik agama islam pai
6678,anjir fuck kontol kuda locator
6679,islam nusantara taming komunis syiah liberal hancur islam indonesia
6680,pa ai adil sejahtera antek komunis
6681,patung tugu tawar besanding lokasi simpang kampung kagungan ratu camat tulang bawang udik lampung tebak gambar im3 ooredoo
6682,angkat tangan gerak serius sumpah lucu
6683,laku o rezim perintah apresiasi sisi kerja rumah selesai semoga periode 2 tingkat deh berani benah kerja rumah
6684,ajak ulama dingin situasi sejuk situasi presiden jokowi
6685,ahli ekonomi dengar cetak uang inflasi rupiah harga cetak sesuai nominal admin sepe i mohon koreksi salah
6686,te awa maki noob eh by the way out ena bang
6687,kali angkat jempol isi nyata tindak aksi tes the water bela agama sejati abal abal dukung nyata
6688,marah kasihan kerja keras bacot diam kerja keras bacot bau mulut
6689,oh lupa terima kasih presiden jalan negara jamah aspal mulus pos lintas batas malu malu serasa surga
6690,cont phoebe tatap x94entah anu intimidasi ramah orang asing temu ilya gendong hadap tangan mungil
6691,suruh munawar mimik kencing onta munawar munafik
6692,ejek kafir komunis antek asing
6693,rebut saham utang utang tukang tipu duit pinjam pakai citra somplak rezim
6694,oh scamming urus bego orang butuh
6695,orang te awa gila orang te awa waras
6696,tangkap bunuh bajing harap tegak hukum
6697,eh bang perek lihat
6698,game angkat film bagus coba assassin creed kacrut residen evil oke
6699,pasal babi baca last twit locator
6700,anis menang gurun pasir onta
6701,jancuk
6702,dongok tumpang makan rakyat kerja nyinyir
6703,emak ku bilang te awa kunti
6704,patut tunggu bani hoaks bangun ahok sepe i nelson mandela malu ahok tahan lupa sepe i mandela mandela pahlawan ahok pimpin suka marah marah
6705,basmi perhati orang onta
6706,ganyang pa ai komunis indonesia wajib jaga negara republik indonesia pancasila locator
6707,keren warung tegal pakai taplak meja
6708,pikir agama asli indonesia islam impor kristen impor hindu impor buddha impor yahudi impor komunisme impor impor alir animisme dinamisme pelihara alir jahiliyah x ya
6709,anjir pikir kocok ya
6710,ku negeri masuk favorit favorit minoritas minoritas 50 50 muslim kristen katolik kelas
6711,seni budaya
6712,orang orang ahok p jokowi anggap hina islam kepleset lidah bela bela agama niat hajar lawan politik agama alat transaksi politik mal
6713,kuda sepe i onta
6714,dasar cina goblok bayar kucing gembrot model
6715,biar sakit kudis tapak barah obat amin utus malaysia utus online locator
6716,halo skripsi transgender coba cari website suara lgbt jaka a km yogyaka a km coba lembaga swadaya masyarakat kebaya good luck
6717,haha bisu tau orang bisu roman tangan beli kuih raya
6718,even ustaz serban jubah putih drive celaka golong golong babi anak anak
6719,serba dadak peci dadak ulama dadak singgah pesantren dadak sahabat nabi kitab suci fiksi dadak bela islam bawa asa salah 411 212
6720,media oposisi jokowi mundur negarawan locator
6721,siapppp tunggu 2019 cepat jokowi lengser negeri kacau balau
6722,contoh lihat bayi lahir cacat lahir x sempurna bayi tanda allah zalim hamba allah x tau sabar uji allah
6723,asli geblek suruh kasih saran kritik asli no h sumatra offshore far bagus bikin penasaran cepat banget narasi kali ya
6724,aduh kesan insensitive sis xef gede gede bom tempo asosiasi cadar negatif eh
6725,kerja bani tlembuk stres akibat jago nyungsep jabar jawa jawa timur
6726,sinergitas tanggulang terorisme badan nasional tanggulang terorisme polisi daerah bal rangka sukses pilih kepala daerah serentak 2018 tahap pilih 2019 wilayah provinsi bal badan nasional tanggulang terorisme badan nasional tanggulang terorisme
6727,men mensiv uhuwww mw brojol semoga langgeng tengkar tengkar bom bom car semoga panutan gubya mwaaaa
6728,wayang golek mar keluarga hina dorna orang suka hadap mar keluarga maaf maaf langsung
6729,mata najwa debat jaka a cina babi ahok banget sok pintar banget ahok
6730,susu kontol manis susu kental manis
6731,cebong norak
6732,paham hadis potong potong mulut bau pesing ajar hadis air kencing onta
6733,ups 2 x ngentot kontol kakak ngaceng iya
6734,habis kerja 11 tk rumah nasib bujang kawin mampus bini sangsi rumah bini no 2 haha
6735,benci cemburu seringkali bajing oyak oyak isi hati
6736,biar edan lil
6737,malam salah
6738,kecewa bisu
6739,pas tegur deh tau mata pakai sipit sipit terka terka tegur
6740,tai kucing sirik ganggu diam cuk
6741,rajin salat hijab hukum wajib tau lesbi alas bikin orang paham asa asa pandang allah
6742,solo susilo bambang yudhoyono 10 jam kampung bin udik parah 25
6743,hancur pa ai demokrasi indonesia juang a antek 2nya kumpul kafirun munafik
6744,babi ahok ejek onta biar injak injak onta
6745,presiden joko widodo resmi cabut 14 proyek daftar proyek strategis nasional play station network alas
6746,
6747,orang mengatasnamakan muslim picik surat pemberitahuan yahudi
6748,tolol
6749,ngewe pantai enak bro gay video gay lokal ngentot
6750,jelang pilih kepala daerah anggota polisi sektor tegalrejo polisi resor magelang sambang dds tokoh agama a
6751,anjir mati listrik pulau nama euy
6752,budaya sunda bikin mahasiswa asing jatuh cinta
6753,orang pintar gila mati mati mati langkah ketua
6754,rakyat paham hoaks golong kampret rakyat paham kerja perintah dasar sampah
6755,berisik jablay hebat
6756,mending berita menteri joko jokowi mundur gagal hadir perintah kualitas minimal ber intelligence quotient
6757,1988 wilayah palestina kosong palestina salah propinsi khalifah turki usmani turki hancur sekongkol yahudi dukung ronta kemal attaturk
6758,gubernur daerah khusus kota hormat kasih saran tolong tpa sampah emen rumah mal
6759,berengsek boyfriend kuat
6760,pikir baca sadar sadar sadar terima lgbt baca fan fiction mudah imajinasi bias other bias bxb yahhhh deh pokok
6761,rezim halal gara gara duit malu jabat putus kadang ciduk blunder tabrak hukum parah rezim
6762,pakai rempel taplak meja prasmanan biar seksi konsumsi
6763,tuhan pilih gubernur lari arab cong nelo bencong otak idiot hina banget hidup cong
6764,dewan wakil rakyat daerah sibuk terima suap kandidat pa ai politik dukung pilih kepala daerah langsung hapus
6765,noob
6766,shua saudara kunti oppa
6767,bocah jaman now colok memek becek bahan coli memek colok memek colok memek jembut memek becek locator
6768,edan retweet 800
6769,ganyang pa ai komunis indonesia perang buka generasi pa ai komunis indonesia umat islam
6770,kader fitnah jokowi antek komunis contoh tau main isu pa ai komunis indonesia
6771,bego nama internet aduh goblok
6772,kasih kendor bubar organisasi masyarakat eh mimpi umrah tenaga kerja indonesia
6773,cinta kunci hati cinta hormat sayang cacat milik pasang tutup tengkar api sekam syukur terima x9
6774,tau tau picek swafoto
6775,titit titit tamasya tai ah
6776,mantap maju binasa salam cebong mania
6777,pets khusus kucing anjing longstream niche salah affiliate amazon niche kucing anjing jual pakan aksesori
6778,eh ngentot marah
6779,ruhut prabowo kebelet calon presiden komentar locator
6780,kereta bandara tai banget ganggu jadwal kereta listrik
6781,koruptor lindung komisi berantas korupsi bubar bawa negara perintah koruptor
6782,berita gubernur banten eksplorasi panas bumi batu kuwung jalan terbit panas bumi news
6783,anak putri langit bisu langit biru milik robot sair
6784,jaman kuliah menu ampas enak magelang masak mas
6785,cebong dongok otak jongkok
6786,zaman orang orang munafik kerja orang orang kafir runtuh islam
6787,gusur paksa langgar berat ham utama hak ekonomi sosial budaya situ hak huni layak hubung novel baswedan hak asasi manusia huni layak
6788,transformer mobil ubah robot uji nasional bas komputer orang pintar ubah haji bolot
6789,orang spi onta united state of america yahudi pakai otak pakai onta
6790,anjing komen mention cebong budug takut anjing
6791,waspada nama ham ujung k
6792,bangsat baca bangsat
6793,oh paham cewek cadar cerita kali kasih tau cerita minum anjing pelihara anjing paham dasar banci asli cowok samar cewek cadar locator
6794,status kafir relatif gantung tinjau sudut santai
6795,desa udik definisi universal buah aglomerasi mukim area desa rural indonesia
6796,takut salah fokus 10 ribu lapang kerja nyata asing
6797,ajar tau budaya palembang cari
6798,gilir butuh sok baikin gilir butuh diam diam jelek setan
6799,kasih info awardee beasiswa asing tar bocor australia
6800,undur undur fc culun tim hebat lawan persib undur haha fuck joko driyono
6801,semarang kaline butek sing sayang mata picek
6802,foto asma dewi anies sandi ruhut terang benderang teriak teriak bunuh ahok
6803,masuk nikmat penjara anak alay modar
6804,wadaauuuwwww oi kalem oi sabar sabar tunggu gara gara sipit keparat kebal hukum emosi rakyat kendali jejangan strategi
6805,x9cdaripada suap makan lezat ejek gendut maaf hina sahabat choji akimichi
6806,presiden threshold 20 zalim demokrasi batas calon threshold 20 batas layak orang calon integritas calon ketatanegaraan antek asing asing x
6807,tipu tai sumpah berkah hidup anjing
6808,babi perangai babi locator
6809,anak culun beda tipis
6810,kangen bajing
6811,usaha hindar cela sepe i korupsi kolusi nepotisme jahat negatif sepe i rezim usaha hehe
6812,alquran orang orang muttaqien maki maki orang orang ingkar kafir musyrik
6813,usir cina cina indonesia indonesia kuasa bebas jajah
6814,inti bacot
6815,antek antek malu ngehype
6816,onta pakai nos mbak 1 jam tenang
6817,jokowi pamer dungu ranah publik kuar locator
6818,henti ngewe dunia lucu
6819,kemarin gubernur pilih umat impor bawang cina riak antek asing
6820,ciri khas cebong lekat kalah data fakta langsung otak porno 2019 ganti presiden 2019 presiden jokowi
6821,76 24 sabar laksana tuhan orang dosa orang kafir
6822,korelasi hindu buddha masuk nusantara maaf paham alur otak kaum cebong
6823,kuat gembos rejim takut 2019 ganti presiden rampok ri takut bangkit bangsa bangsa daulat makmur kuat pimpin
6824,mustahil rezim berani laku
6825,tarik ulur kait beda pandang definisi terorisme fraksi fraksi dewan wakil rakyat
6826,bati tonton bola angin masuk euy
6827,pilih 2 stop dana hutang uang
6828,babi buta tito bela jokowi pungut liar lingkung polisi geliat sadar
6829,help desk padu komisi pemelihan ri bantu selenggara pilih kepala daerah 2018 pilih 2019 konsultasi sila hubung 021 31902573 31902583 langsung ruang help desk lt 1 komisi pemelihan ri jalan imam bonjol no 29 jaka a senin jumat 08
6830,uji nasional pilih sosiologi fi sekolah mantap mata ajar ilmu sosial bangkai
6831,masuk atm lihat kondom jatuh milik empunya buru buru ngempet ngewe lupa bawa uang ehe realbo relevan
6832,kampret tolol orang susah tau tau copy paste lengkap malas bahas sodor copy paste gambar tau sumber payah
6833,manusia sinting locator
6834,biadab teroris buddha myanmar bakar al alquran
6835,primata tau eh embrio cebong keluarga surat surat lengkap bayar eh tolol hidup pikir lihat goblok dungu
6836,mundur jabat presiden
6837,laptop jangkit virus babi laku
6838,assalamualaykum tidur dengar lagu nabi mandi acara teman tidur ken entar sakit natural killer
6839,sederhana identifikasi bajak agama ayat ayat suara damai musuh ajar ajar ria hati tenang hati panas
6840,bacot mulu tenaga kerja indonesia tenaga kerja asing urus anggota tata kota e i lihat daerah khusus kota amburadul tats kota
6841,muka tahan tai jack
6842,lihat orang indonesia jalan kaki pandang belah mata gilir orang asing jalan kaki negeri takjub habis habis
6843,sila duduk mbak samarinda yogyaka a palembang panggil koko alas utama mata sipit nikmat bugis banjar tionghoa
6844,keren
6845,masyarakat keluh kerja anies banjir pimpin mantan gubernur ahok sukses musnah banjir jaka a berita link jp reader tanggap tangan banjir pollin
6846,ateis percaya surga neraka hangat
6847,gede tau kemarin banci eta trh
6848,1 kivlan zen oceh siang transfer uang prabowo dramatis indonesia lawyers club isu pa ai komunis indonesia masyarakat cuat indonesia lawyers club pa ai komunis indonesia
6849,hidup nebeng cina cina milik jongos cina paloh bewok
6850,edan marah
6851,usir cina indonesia rusak bangsa locator
6852,memek becek
6853,rezim upaya cuci otak generasi lupa sejarah hebat mi tuhan rezim kacang lupa kulit puja asing anjing anjing komunis
6854,suyanto mitra surat perintah henti sidik kur bank a ha graha international optimis program daya 142 padi hitam 70 padi putih potensi panen varietas capai 9 ton gabah kering program lestari tradisi masyarakat tani jawa
6855,7 dokter muka halo monika kabar ganti presiden kali ketemu
6856,konsep sekuler demokrasi butuh negara sekuler jalan sepakat konsep sosialisme komunis butuh negara komunis implementasi wajar aqidah syariat islam butuh khilafah tegak laksana cakap
6857,saudara aji semoga allah izin gus ipul mbak puti gubernur wakil gubernur jawa timur saudara aji kota batu saudara aji jombang jombang gemerlap
6858,papa panggil memanggil nete
6859,panitia kerja panja pilih kepala daerah komisi dewan wakil rakyat ri laku kunjung kerja kota malang selasa kemari panja pilih kepala daerah proses pilih kepala daerah kota malang news highlight source
6860,kualitas kader buta sejarah goblok tolol salah perintah sumbang hadap bangsa pikir sapi ladang tumpang makan doang
6861,orang jaman tau pisang obat pusing monyet pusing
6862,tim anies sandi perlahan bau harum cium orang orang kerja tim 1 1 ciduk
6863,bunga bangkai
6864,alay banget tai tentara ngewe banget tentara ina malu
6865,bacot kampang
6866,jilat pantat asing
6867,inkonsistensi lucu
6868,x9cmaju anjing fanny babi sakit perut gelak locator
6869,bilang anjir bagus
6870,geblek banget
6871,ulama abal abal puas misi capai lengser jokowi prabowo ahok doang
6872,onta paham online online
6873,uang tabung anjir tabung daun
6874,indeks harga saham gabung buka kuat level 6 303
6875,eh kunyuk embat dana umrah diam ya
6876,nrp bacot banget
6877,suka pamer orang peduli pamer puji kampung
6878,ka iriana kumpul istri menteri gubernur istana bogor
6879,foto doang anak idiot
6880,gilasih kimia organik kemarin modal gambar struktur doang benzena angkat tangan bangkai putar putar setan
6881,jokowi otoriter diktator represif sepe i orde rindu soeha o duit tinggal kerja kerja kerja
6882,negara dunia cengkeram komunis asia tenggara negara jatuh tangan komunis
6883,pakai chara tuyul ngecamp greget pakai mod kena banned
6884,bani oplos bikin demo by the way kitab umat islam
6885,sampa kolong tol orde a i gubernur geb anis kerja bro presiden ganti soeha o sekolah dasar kerja kerja enak bacot
6886,pa ai demokrasi indonesia juang beber ongkos rogoh pa ai demokrasi indonesia juang ca er pesawat jokowi dasar korupsi locator
6887,orang paham bicara fangirl antek antek
