,Tweet
0,cowok usaha lacak perhati lantas remeh perhati kasih khusus basic cowok bego
1,telat tau edan sarap gaul cigax jifla cal licew
2,41 kadang pikir percaya tuhan jatuh kali kali kadang tuhan tinggal orang tua rencana pisah kakak pilih kristen anak ter
3,ku tau mata sipit lihat
4,kaum cebong kafir lihat dongok dungu haha
5,bani taplak kawan kawan
6,deklarasi pilih kepala daerah 2018 aman anti hoaks warga dukuh sari jabon
7,selesai re watch aldnoah zero kampret 2 karakter utama cowok kena friendzone bro xd locator
8,admin belanja po makan ais kepal milo ais kepal horlicks cendol toping doket gerai rozak me ua taipan 2 kembar baby romantika bank islam senawang
9,enak ngewe
10,jari ukur nyali bacot
11,banci kaleng malu 2 nyungsep koe locator
12,ajar ekonomi mesti jago privatisasi hati orang aduh ironi
13,aktor huru hara 98 prabowo lengser perintah jokowi nyata
14,bu guru enak jablay guru sekolah dasar nikmat pecun guru
15,lawan bicara intelek otak kencing onta hadis nabi sahih kafir tolak ahlun nar
16,pikir ampas banget ya
17,ari bek rapi monyet
18,cowok gantle gantle nama banci
19,alga mnr bom
20,anjing jarang ambek takut budak cinta
21,noob peluang sakit gede
22,joko widodo nilai presiden lemah sejarah indonesia jokowi milik modal dukung politik ketidakmampuan perintah hadap situasi ekonomi
23,ajar camat bilah hilir deklarasi anti hoaks pilih kepala daerah 2018 damai
24,bandara udara internasional ajati bangun gubernur ahmad heryawan anggar belanja negara perintah pusat insya allah operasi
25,gubernur presiden rakyat
26,kerja delay mulu setan
27,pintu sorga pintu sorga asli pintu hati modus banget
28,pa ai komunis indonesia muncul jelang pilih kepala daerah pilih presiden goreng gosong
29,nenek nenek heran cebong bohong
30,islam nusantara produk jil pasar gencar antek jil jil anti arab pro asing almarhum kh hasyim muzadi
31,habis sahur jam 10 bayi nete kali lemas
32,emak suka sipit
33,laku homo jaman now ngentot live blued gay video gvid lokal hangat locator
34,orang jawa maaf orang palembang kakak deh ajar aksara jawa kelak ajar budaya palembang
35,pegawai guardian training mentang mentang gembel kaos flat shoes dijutekin bangsat malas beli kabur matahari
36,x9dpara bajing luka lady terima ganjar ratus kali lipat sanji selamat ulang laut jkt48
37,aja tolak berita hoaks sukses pilih kepala daerah wilayah kota
38,presiden ri jokowi kerja tulus ikhlas rakyat jokowi
39,edan tuju fabiano
40,al alquran bang mulut orang kafir bejat hina farhat abbas law
41,lihat beda wibawa wibawa gubernur indonesia masya allah
42,anjir kali lihat orang bego debat pilih kepala daerah kerja serang karakter kecewa on empok silvy and agus debat final pilih kepala daerah jaka a
43,gubernur zaman now gus ipul puti 2 ganjar yasin 1 djarot syiar 2 hasan anton 2 koster ace 1 nurdin sudirman 3 karolin gidot 2 keanekaragaman budaya suku agama sungguh djarot hadap a rakercabsu
44,islam lokalisasi kristen mas nusantara mas lihat gereja bandung pakai gamelan khotbah pakai bahas sunda jawa huria kristen batak protestan nusantara
45,cipta situasi aman te ib masyarakat jelang pilih kepala daerah 2018 kepala polisi sektor konang silaturahmi tokoh masyarakat
46,positif nse positif respon masyarakat hadap cangkul impor garam impor beras impor jagung impor tenaga kerja impor esemka impor nurl
47,sembahyang adopsi tradisi lokal kerja hindu istilah xa0sembahyang xa0pun lahir tradisi ritus xa0menyembahhyang tunggal xa0shalat sembah all
48,didik bodoh larang bawa agama biar orang islam bayar ahok sadar pilih ahok gila
49,ahok the best abai kaum kampret otak micin
50,otak tempurung laden lawan dungu makan hehe
51,awaasss berita saudara gerung susah cari kosakata bocor picing mata bibir monyong samping suara ky nhn kentut politik kotor zaman b pulang ky nhn ngeden dungu
52,pinokio umur 3 2019 ganti presiden
53,cerita silat lae kho merah muda oh indonesia liang ie shen tulis cina
54,benci umat islam
55,provokasi mayat politisasi agama kalah pilih kepala daerah daerah khusus kota cebong deskripsi kalah junjung for your information ahok pilih camat wakil etnis mayoritas
56,nete
57,bani lowo
58,takabur lahir kuasa rakyat ulama cendikia iblis makhluk alim ibadah atus ratus laknat hasud takabur orang ahli ilmu filsafat failosof mari demo sendi
59,a orang suka konser konser boros
60,makan racun ulama hukum rokok mubah
61,susilo bambang yudhoyono presiden ri 6 khofifah emil masyarakat no 1 bagus khofifah emil nomor
62,kali gemar korea pop omong teman teman idol banci homo
63,suka video kisah seteru haji bolot malih tongtong
64,budaya kafir sungguh islam indah
65,hem hem diam bisu coba rumput goyang
66,setan bisik was was lindung allah qs al a x99raf 200 fussilat 36
67,ateis sibuk agama orang
68,lengser jokowi bangsat
69,selamat ka 2019 ganti presiden 2019 presiden
70,bajing homo hati hati hadap anak anak utama kamar mandi laki laki biar locator
71,cocot
72,budaya indonesia
73,ajar salat a orang asing pecah belah islam
74,x bicara bangkai
75,percaya negara jajah ranah bubar sistem sistem beraja negara negara republik komunis negara negara jaja
76,nikmat bijak usul pa ai komunis indonesia
77,umpama orang cina usir paksa indonesia
78,bunda ngentot yuk
79,cina babi cina maling usir cina
80,karno anti asing beliau jawa coba deh adakan konsensus jawa anti asing pro asing kebo ohannya keliru tutup akun
81,proyek korupsi rezim susilo bambang yudhoyono locator
82,wajar lihat tingkah petinggi negeri suka campur bahas indonesia bahas asing kali bicara
83,ab pribadi senang kompetisi positif
84,kitab suci agama bilang om dadak kalap
85,suka tutup mata tutup lihat tutup gara gara sipit
86,muslim nista kitab suci alquran an alquran an suku detik makna faktual umat islam makna sirat fiksi
87,eh kasar kampang
88,bentar rilis album the onta
89,cebong bang
90,najis banget mentwit barusan he
91,transgender anjing locator
92,awas bintit intip titit kucing
93,bawel bawa asa bolot bodor deh
94,saran bacot maling ayat langsung to the point orang paham riak kafir sesat liberal puja dukun bla blaaa hati puas deh
95,salah target ahok agenda utama lengser jokowi
96,kena tagar panas banget 2019 ganti presiden
97,maju duit goyang kaki pape duit maju kat bodoh locator
98,huria kristen batak protestan pecah kristen katolik zaman jajah belanda nama kristen protestan kristen katolik pecah huria kristen batak protestan pe ama kali tarutung k
99,baca biar pintar jepang amerika cina utang tau
100,prabowo kalah bantu jokowi citra ratap pilu
101,takut azan iblis
102,goblok bani cebong tukang tipu jilat kuasa gera bayar pakai nasi bungkus propaganda nasi bungkus gagal
103,cebong sewot
104,2 gera tekan kerja keras total tingkat potensi bangsa
105,gubernur djarot mayoritas pa ai politik dewan wakil rakyat daerah dukung ahok djarot payah locator
106,rezim rusak sistem sibuk cari cari salah ketemu komisi berantas korupsi alat besok perintah ganti ulang engah selesai organisasi orang
107,orang orang tuding antek asing asing sungguh tepuk tangan
108,anti asing
109,selamat semoga kiprah tingkat nasional
110,asyik menang ulama
111,ketapang tenaga kerja asing asing kerja usaha masuk pt who tambang bauksit viral pilih presiden kerja era gubernur cornelis wakil
112,anak pecun hobi zina haha
113,bom surat harga syariat negara
114,istirahat presiden momentum saksi telinga mata rapat bentuk pacitan 2003
115,1979 house select committee on assassination hsca temu cacat investigasi laku fbi warren commission hsca simpul tembak laku konspirasi
116,asa genap 1 17 april 2018 gelar hajat pilih presiden acara negara indonesia pilih presiden semoga senantiasa jalan aman lancar amin
117,ian pantat
118,orang pintar agama agama nista hujat orang orang bodoh orang maaf lahir idiot harga cipta tuhan iblis pintar licik
119,daftar calon presiden pilih presiden 2019 buka agustus 2018 normatif politikus pa ai demokrasi indonesia juang paham 2019 ganti presiden
120,tolol tau perintah rezim komunis bobrok koruptor pimpin sidang dewan wakil rakyat paya cebong locator
121,mantan mantan sedih pikir tidur anak berengsek laki laki
122,cina rusak bangsa usir tuju
123,2019 ganti presiden konstitusional hak rakyat woiii plonga plongo laku otoriter
124,mari wujud pilih kepala daerah kota bengkulu 2018 aman damai cok adem86 98heru
125,serius presiden jokowi islam nusantara kristen nusantara buddha hindu kong hucu nusantara
126,nyata moeldoko bukti istana takut bangkit umat islam
127,cowok jago drasex ngentot adik luvian
128,kroasia kafir tau ajar kafir lupa kapling sorga
129,menteri soeha o homo
130,tau culun takut orang ubah perlahan lahan buruk
131,perang salib raja afrika babilonia peluk kristen tobaco peluk islam
132,kejar setor bangsat rupiah turun
133,semoga tindak lapor hadap nista agama adek armando laku langsung ketua front bela islam kh shobri lubis badan reserse kriminal markas polisi republik indonesia gambir jaka a pusat selasa 10 4 13 00 indonesia barat perhaps
134,bangkai hajar
135,onta mati minum
136,uniform ahok tng was was hidup
137,sul teng ekses akibat sandera hutang cina 2019 ganti presiden 2019 presiden 2019 jokowi ganti
138,6 pride yunani xe1 xcf xce xcf xce xcf xce xce xce xce hyper xc4 x93phania angkuh harga sombong kenal hubris vanity harga ubah manusia sombong sombong manusia kutuk mata tuhan manusia cinta
139,tuju hati logika hati tenang logika hati sedih ku cari wasiat beliau tinggal asing asing mata manusia duhai
140,taji komisi berantas korupsi era era komitmen berantas korupsi surat pemberitahuan era susilo bambang yudhoyono
141,admin tolol pa ai tolol pa ai tolol orang tolol
142,ayu ting ting goyang hot raffi ahmad nagita slavina kampung norak locator
143,video tenaga kerja asing malaysia kutip nyata
144,ppp buru buru tolak wacana pilih kepala daerah dewan wakil rakyat daerah
145,random pagi pagi samper meja kerja pakai bedak biar muka bersih istri butek ku pakai air wudhu ku kristen
146,kampret
147,memek lonte sodok kontol gede
148,jokowi mundur tutup locator
149,bicara mulut sepe i banci beli kaca lihat bro
150,amin racist nada nada ratna paiiit nada onta nada lobang anus takut oi oi habis obat tenang ya
151,tunggu komando imam bejat cabul tai bir bawa ulama dasar banj sempak
152,kabinet beranta pecah belah rezim
153,pintar orang politik kaca oi tampang k xc3 xa6k orang bego
154,pa ai demokrasi indonesia juang menang tekan usaha tambang target proyek impossible lelang murah antek cina ntb contoh pa ai demokrasi indonesia juang menang dasar bajing
155,percaya mulut buaya mu bawang
156,2019 susilo bambang yudhoyono prabowo lawan mega jokowi peristiwa 2004 ulang pa ai demokrasi indonesia juang incumbent kalah mutlak susilo bambang yudhoyono jokowi mega susilo bambang yudhoyono lawan prabowo mk pilih presiden selesai 3 poros pilih presiden mk salah lawan
157,banci kaleng gatot gaduh gentleman mundur saing pilih presiden 2019 lawan jokowi
158,bebal
159,5 indonesia negara populasi muslim dunia islam rupa musuh barat komunis hambat agenda obviously
160,umuh persib persib kunyuk
161,film muslim pilih ahok mati salat jamin laris
162,banu banu yahudi beda banu banu kristen suriah salah beda banu yahudi pakai eloah elohim yahwe suriah pakai alah allah
163,eh muka merah merah cendol setan cuaca panas
164,berita saracen diframing katak tim prabowo anies sandi media tumpah sakit hati katak cebong ehe
165,giat bhayangkara bina aman te ib masyarakat brigadir polisi manajemen bas sekolah sihombing rabu 11 april 2018 laksana sambang desa tatap muka pantau aman te ib masyarakat tuju pilih kepala daerah 2018 desa lobusiregar i rumah rudi panjaitan helm siahaan hotman siahaan
166,sayang banget lihat perempuan status tempel laki laki aduh nagita slavina blak blak ayu ting ting kampung viva locator
167,lupa kang umat katolik minoritas perhati gubernur golong golong
168,cebong bilang kemarin eyel situ paksa cebong
169,lemah gerindra orang prabowo turun elektabilitasnya congor fadli zon surat pemberitahuan durno
170,selamat ka kali raya makna kali
171,foto bisu milik a i susah a i sepe i susah a i putus
172,alam muncul grub wa a bani abdi had a k a mbah mek kenal orang
173,ayah pres badar nuqaba boekkk hebat bidang agama x takut natural killer tegur member lawak hambar lawak orang jom gerak gera badan chubby
174,orang anak pekan ilham dasar ekonomi deb gerak utama maju ekonomi bandar beliau allah rahman tun abdul razak ds malaysia pilih hogohundi
175,haha sialaaan nyata lapar presiden sikat
176,nasihat kali ugal ugalan rezim eh negeri keburu hancur ekonomi moral meni kacaoooooo
177,alah silit kebelet kasihan orang sayang media sosial sadar instansi kemarin cerita duuuhhh
178,cacat
179,2019 rakyat makan aspal beton solusi jitu miskin ahli cebong 1 tukang tipu cebong goblok ketulungan plonga plongo akibat optimisme 2019 ganti presiden
180,baca harun yahya belot kubu yahudi freemason kadang suka percaya
181,maju ulama gerak tokoh agama indonesia gus mus
182,
183,mukidi percaya mudah keras keras nama
184,kemarin hujat harap dasar bani kampret
185,fitnah sila ban apollinaris darmawan al alquran kitab sampah
186,monyet koloe bilang saudara ogah hidup hati comberan
187,body lufra scrub bahan dasar lidah buaya melembabkan kulit cahaya info 087812026394 body mass indeks
188,cacat
189,anut bumi datar teori bumi bulat orang asing notabene musuh
190,becak warga binjai sita tenda tulis 2019 ganti presiden pa ai adil sejahtera radang bukti perintah panik takut
191,jokowi mundur
192,musyawarah nasional alim ulama ppp semarang hasil rekomendasi syarat kriteria kriteria calon wakil presiden damping jokowi 2019 romahurmuziy
193,cerah gagal anak ekonomi
194,kafan budaya yahudi umat islam klaim
195,rezim kendali negara cina komunis patron tunggal rezim anti islam jokowi
196,tanda pilih kepala daerah pilih presiden
197,misi 4 bangun masyarakat gotong royong toleran harmoni selaras nilai budaya jawa barat luhur nomor jawa barat asyik asyik menang
198,tabah pasang taufik puan nurliyana wajar contoh jom sumbang ringan beban pasang come on twitter do your pikir badan standar nasional 0510541000096745 bank islam 05058020145124 nurliyana bosan abdul razif
199,tai doang belaganya langit karma idol flop te awa keras
200,celeng kangen iya
201,rang negeri budaya yuk unjung purwoke o mumpung even rakyat purwoke o ekstra vaganza banyumas
202,presiden dana taktis rakyat program program perintah program bangun infrastruktur kip ka u indonesia sehat ifikat tanah hutan sosial bahan bakar minyak 1 harga padat karya
203,amin allah tim latih ular rawa rawa sungai gede musuh buaya
204,maju maki mama bolot
205,gerombol kadal jidat gosong suka ribut gerombol salah pura pura budek dasar gerombol cingkrang locator
206,gentar takut hadap kafir
207,saracen akun kritis anggap saracen aneh jokowi
208,bego teman najis kesal
209,kafir kristen ulah
210,tau bau bau cir sipit buluk
211,pegang mucikari
212,guru tk darma wanita desa plumbon porong deklarasi anti hoaks benci isu sarah dukung pilih kepala daerah damai
213,anjir seram main
214,bank bilang jual uang asing tukar rupiah
215,onta yaman depo asi
216,hati hati berita pilih kepala daerah bau hoaks madiun madiun today 100thmadiun kotak karismatik madiun tolak cukai ilegal kunjung
217,anak cocot
218,x88udah hoaks fahri ambil berita tuyg tong sampah ambil screenshoot tau berita
219,mantap baris serba bang
220,nyata lebah suka bunga makan bangkai penasaran madu
221,indonesia mundur bentuk
222,dongok bilang hacker haha
223,haha blunder cebong protein energy malnutrition pusat alas ham rakyat aceh kali coba perintah bilang suruh hukum islam kaffah aceh dewan wakil rakyat a
224,bangsat selam 1
225,pancing pancing urus nista bicara paham fiksi kitab suci
226,cebong kacung teman dungu tulang sumsum buang buang energi debat
227,pa ai korupsi sapi goblok
228,sinyal kontol pelihara niat login twitter doang susah open redtube setan
229,mata kafir
230,facebook anjir lupa
231,bilang alah kontol
232,nikita mirzani pakai hijab bicara cebang cebong fantasi uh ah cokorers
233,tatap alih arah enggan tatap pria curiga pe ama kali gaduh suasana angie temu orang pria asing tidur sofa sepe i
234,lahir kembang gera komunis indonesia pisah buah organisasi nama indische sociaal democratische vereeniging
235,shaheizy wajah baharu calpis
236,ya serah balas fokus kerja kerja tugas proyek seni budaya 2 langsung kumpul presentasi syukur nilai muas proyek
237,bro
238,laku bodoh masuk kategori senang laku sontoloyo menganggu bangsa laku naif langsung bentuk intimidasi hadap ulama laku
239,monyet turun mukim warga cibadak sukabumi locator
240,kotor bahagia warga cebong e i
241,giveaway taplak meja menang the rich chenle
242,buka busuk kubu anies sandi menang berkah prabowo usaha cuci tangan
243,bodoh bang
244,orang bego bro b ego
245,menteri lingkung hidup hutan upaya perata ekonomi tora kawasan hutan hutan sosial tribun medan
246,mahfud md allah subhanahu wa taala berang bangsa ajak buang islam
247,orang orang bego minum makan kotor onta otak somplak
248,kuak strategi kampanye tim menang anies sandi locator
249,warga badui selesai tradisi seba pendopo perintah kabupaten lebak temu gubernur banten wahidin halim sabtu 21 4 seba badui 2018
250,lembaga lembaga anti korupsi bubar sentuh kuasa gilir komisi berantas korupsi pa ai demokrasi indonesia juang pa ai politik kuasa pulang otot bubar komisi berantas korupsi
251,mas sudut salah agama bahaya rocky cerdik susun kalimat inti kasih tau e i fiksi ayo mas i
252,dukung calon presiden gagal pindah on sibuk urus asing bawa kabur uang rupiah 35 t sadar asing kabur bawa uang dukung pribumi anjing mustahil asing pribumi diam sogok mental kacung locator
253,rabun budek tulis bicara
254,bismillah tahan sepo kutuk
255,brahahahaaa cebong ahoker cebong cebok
256,pembaruan status bikin tugas tugas selesai jancuk jembut
257,muslim jabat negara tindak bangsa negara
258,12 ikan sembuh sakit selamat bagus laik jual pisah seleksi ikan cacat permanen pelihara sehat ikan ncc
259,a i pribumi sadar lihat kecuali cina komunis misionaris abai twit usir cina indonesia
260,presiden tuduh rezim anti islam negeri umat locator
261,manusia bangsat
262,cina kenal wisata haram indonesia haha
263,prabowo pa ai adil sejahtera bib asyik anggap antek prabowo antek pa ai adil sejahtera hidup dramatis
264,sahabat salah lovren bukti beda suku agama ras halang bina hubung umat manusia beda warna jalin teman terima kasih lovren salah favorit best friend forever bro
265,lae turun turun ideologi pa ai komunis indonesia lekat jiwa
266,kesal rokok motor kadang pengap tutup macet
267,maaf kunyuk bro enak banget rasan sebar hoaks maaf sebar hoaks maaf mesti sapu biar jera orang locator
268,halo warga jaka a wakil kepala dinas tanam modal layan padu pintu provinsi daerah khusus kota jaka a denny wahyu haryanto wakil wakil gubernur provinsi daerah khusus kota jaka a buka acara 2018 junior chamber international jci indonesia nasional event setia layan jaka a
269,2 kuat jaring gubernur tekan kuasa state of the a knowledge a bahasa rantau indonesia
270,pandang tuan guru bajang hadap agama politik
271,sedia berengsek
272,susilo bambang yudhoyono presiden ri 6 khofifah emil masyarakat no 1 bagus
273,dungu orang ganti presiden tau mikiiiir
274,bokep cewek bispak bandung ngentot crot unduh full uniform locator
275,kampret complain raga tanggap fuck
276,jablay grand theft auto jemput pakai mobil
277,lihat memek tante
278,kerja musuh dakwah islam bubar hati rakyat hak lengser jokowi kodok tukang citra
279,ha lengkap orang bukti goblok
280,x9ctidak salah orang khalifah rasyidin x9ckami rang orang kafir x9ckalau orang orang munafik x9ctidak orang munafik
281,suka nete uji nasional maklum
282,nek lihat match chelsea menang mudah manchester united embuh chelsea kacrut ki prediksi
283,kali tentara nasional indonesia suruh urus sampah plastik
284,khawatir manuver politik bijak laku rezim semoga negara republik indonesia cinta amin
285,madi arya lapor rocky gerung polisi serius kitab suci fiksi rocky nyata salah hina tunggu anut agama a anggap kitab suci
286,bajing tengik
287,pakai buruh cina rakyat anggur dasar rejim kodok
288,
289,rupiah haneul cute pacar perek on retweet
290,bilang anti asing asing tau
291,suriah sekolah radikal rakit bom pulang indonesia aman
292,kadang hidup tai kadang berak orang beres tainya tangan
293,banci selotipan
294,haha kalah orang jahat kalah
295,gubernur zaman now gus ipul puti 2 ganjar yasin 1 djarot syiar 2 hasan anton 2 koster ace 1 nurdin sudirman 3 karolin gidot 2 keanekaragaman budaya suku agama sungguh djarot hadap a rakercabsu
296,cinta orde meng idola prabowo hary tanoe
297,tantang buka dada eh setan habis kamus lawan kenegarawanan joko widodo presiden ri 7 stresssssss hati hati kena strok serang jantung rakyat indonesia hilang badut badut politik merdeka
298,belah duren dungu cebong maaf ya
299,2 orang orang yahudi nasrani al kitab taurat injil kenal muhammad
300,bubar hati front bela islam locator
301,ahok verbal keras lampias lari lelaki lunak
302,teman teman kantor langgan cadar langsung bilang awas bom hela nafas
303,pantat tusuk tusuk x89open bo wa 08157686707 gay berondong massage boy gay jaka a gay yogyaka a gay tangger
304,ancam bunuh presiden republik indonesia mas mesti lapor tegak hukum tindak ancam bunuh kepala negara
305,orang nyosor nete
306,ngewe
307,jebur cebur
308,pa ai adil sejahtera ulang balai kota rr bicara calon presiden balai kota ganti nama balai politik
309,rencana seret adil ham pbb locator
310,bijak barang konsumen laku barang rusak cacat produksi konsumen puas produk hitung 7 tanggal beli haus mini kuiz hazid kunyuk nuser
311,kisah hidup muhammad lengkap unduh
312,jajah bumi indonesia hapus jajah ekonomi budaya hasil bumi cina basmi negara republik indonesia usir
313,we pipis onta cecer mari bau pesing
314,teriak lantang perintah pro asing tawar bantu asing bikin posko inti kompor keluarga korban perintah bilang 15 3
315,mari juang jokowi lantik 2019 gentar takut mata benang leher ujung tombak perut surut langkah bisu suara
316,monyet
317,survei metro televisi jokowi menang presiden hitung 45 kalah 46 salah judul maksud jokowi menang sumber zie bajrie
318,
319,cuba tegak anime karakai jozu no takagi san feeling feeling cinta monyet zaman sekolah throwback habis 9 10 locator
320,seru pesta budaya derau kuta ka anegara
321,kontak retweet banget kenal tante jilboobs sange nini nama tante dea o
322,debat publik ajang bukti pintar ruang akademik pamer indah orang kuat lemah egosentris nama kuat tahan l
323,duduk istana negara lengser jokowi salam
324,hebat sibuk citra baca
325,muslim hina iblis betina nista syariat
326,baby kafir buddha teroris myanmar
327,indonesia merdeka indonesia jajah orang cina takbir allahu akbar locator
328,politik hanta yudha pasang calon no 2 jawa jawa gayeng 2019 jokowi
329,jongos nista agama ahok sok sok ngong sara majikan tebar sara astagfirullah tobat
330,follow beli katolik akun prof wawas bangsa terima kasih
331,bejat cabul kecut onta iya
332,wibisono citra jokowi sebar up media massa pro asing kes jokowi hasil
333,adi gaya beruk supir tembak metromini masuk dewan wakil rakyat kampung
334,km mainstream mengaa ikan pintar pintar relatif gantung bawa e i surat pemberitahuan pintar meng undeeestimate orang pintar komen rejim now pintar mangkrakan janji janji doang sok making
335,dongok
336,masak sampah
337,pukau 2019 ganti presiden
338,aspirasi lina sumedang calon gubernur jabar berantas rebut laki orang resah hidup warga desa
339,yaelah chat urus lihat mesum anggota dewan wakil rakyat diam nyata selingkuh tujuh pura pura budek cebong intelligence quotient ratus otak
340,takut cina pa y dap bimbang paham bawa
341,cermin pecah kaca
342,langsung tag pa ai berani a i banci
343,awwww comel asing warna
344,islam manusia idealis realistis hidup lupa ajak kerja keras ajak istirahat
345,kristus anjing anjing jembut keparat picek tai pejuh siwuk kutang siwuk idiot keparat picek tai pejuh siwuk kutang siwuk idiot keparat picek tai pejuh siwuk kutang siwuk idiot keparat picek tai pejuh siwuk kutang siwuk idiot keparat picek tai pejuh siwuk k
346,agama katolik katolik nusantara agama kristen protestan kristen protestan nusantara agama hindu hindu nusantara agama buddha buddha nusantara
347,3 bas teknologi digital presiden sistem jalan langsung ramah ratas
348,ah asa hibur cebong bahagia presiden cebong tol cebong germo
349,resah presiden hidup penuh drama citra main film televisi joko judul locator
350,agama kristen golong darah b nasal san fernando valley
351,buddha bunuh muslim myanmar
352,yahudi bangkai jerman ibadah
353,papa ketua fraksi rakyat setya novanto dewan wakil rakyat pecat ketua dewan wakil rakyat pecat dewan wakil rakyat
354,cina
355,hoaks kodok biawak roket sekop bangsat karbitan munafik 2019 ganti presiden 2019 presiden 2019 tenggelam jokowi sungai siak
356,ribut komunis bla bla emoh baca baca niat agitasi serang perintah pakai cari simpatisan
357,10 presiden jokowi harap skema kerja laku bangun bangun
358,pilih langsung biar pilih presiden dewan wakil rakyat calon presiden biar kucing karung bikin mekanisme oke calon presiden gubernur prestasi maju calon presiden gubernur
359,vital inter bek kanan beda era maicon ambrosio cancelo bagus nhmmmm a i simpul geblek ausilio
360,nama agama munafik
361,43 contoh tuding duga korupsi susilo bambang yudhoyono dorong jaksa usut himbau komisi berantas korupsi usut duga korupsi jokowi
362,cium bau bau pecun locator
363,henti konsumen wisata haji rumah tipu produsen wisata jiarah indonesia
364,buru nazi simon wiesenthal pegang foto foto gambar mantan kepala gestapo laki laki rauf buah van kamar gas gerak eksekusi orang orang yahudi
365,caci maki nista agama nyata poligami umpet ogah
366,bubar negara republik indonesia harga mati
367,royson jokowi kacung alas fundamental rezim sepe i sengaja masuk debt trap komunis cina no h sumatra offshore wajib 2019 ganti presiden
368,mampus pepet uji ah
369,gubernur jaman now anti hoaks sebar isu ganjar yasin menang ganjar yasin 1 ganjar yasin
